Liverpool City Region Combined Authority,Liverpool Technical Assistance,ERDF,"The Project will deliver integrated support to all partners and stakeholders wishing to develop projects for the ESIF programme aligned to the LCR strategy. The project will deliver dedicated LCR wide TA activity across ERDF and ESF. It will focus on development of the project pipeline in key areas of the programme and with additional support through partnership engagement, continued support for projects progressing through the application process, promotion and publicity. It will work closely with the GDT for ERDF, DWP for ESF team and DEFRA for EAFRD (rural development). The project will form part of the governance and management of the LCR Combined Authority.",01. Okt 15,30. Sep 18,787645,1332737,59%,L69 3HN, Liverpool City Region , England ,
Vedas Services,High Growth Potential 'Propel 2 Grow',ERDF,"This project will achieve an increase in GVA of £7m, create 499 new jobs and launch 57 new products to the market.  By dovetailing with other local and national support programmes, we will support the capability and capacity of SME businesses within Lancashire to achieve high growth (minimum 20% p.a) by providing in depth market and current state analysis, strategic direction, and then the practical implementation of these growth strategies by developing people capability / operational capacity / new product development through access to world class specialist providers. The beneficiary will be account managed throughout the process to maximise success.",01. Okt 15,31. Dez 18,999004,1998008,50%,BB11 1DR, Lancashire , England ,
Wolverhampton City Council,AIM for the Black Country,ERDF,The project will bring together an increased pool of navigators/account managers who will engage and support businesses to access specialist support from national providers and other specialist support via an ERDF compliant procurement framework. ,01. Apr 16,31. Mrz 19,1824245,3648492,50%,WV1 1RP, Black Country , England ,
South East Midlands LEP,Velocity Growth Hub,ERDF,"Velocity is the Growth Hub for the South East Midlands. It will join up, simplify and strengthen support to increase growth among existing enterprises and increase investment in the area by foreign-owned enterprises.  Velocity will work with national and local providers to add value beyond their individual service offers to assist SMEs on their growth journey.  It aims to simplify access to the right business support to enable SME growth through five activity streams: Velocity Helpline and Web Portal; Velocity Growth Programme providing one-to-one information; Velocity Growth Events; Velocity Revenue and Capital Grants and a Velocity Investor Development Programme which will provide an enhanced enquiries and aftercare service.",01. Jan 16,31. Dez 18,2815814,5631662,50%,MK43 0BT , South East Midlands , England ,
Medilink East Midlands Limited,INSTILS (Inspiring Networking to Stimulate Technology Innovation in Life Sciences),ERDF,"The project will allow SMEs to access high value cutting edge expertise from: sector specific specialists and services; local research entities (university and NHS Trusts); other life science businesses and other sectors.  Access to this support will ensure that businesses can grow by introducing new products and services that benefit from: innovations; identified clinical needs; incorporation or utilisation of cutting edge technologies and early incorporation of market understanding, regulatory and IP management strategies.  This will all lead to: improved commerciality of products; reduced product development timescales; improved resource efficiencies; creation of potentially ground breaking healthcare products and business growth and creation.",01. Okt 15,30. Sep 18,2482417,4964834,50%,NG1 1GF, D2N2 , England ,
University of Northamptonshire,Ready2Grow (R2G),ERDF,"The Ready2Grow project aims to improve the capability of small and medium sized enterprises and to encourage entrepreneurship across Northamptonshire. It will support 445 existing enterprises and 220 start-ups, creating 550 new jobs over the project lifetime. This will be achieved through a combination of events, workshops, advice and financial assistance dependent upon the development need of each SME, which is identified through our diagnostic tool. This project addresses gaps in the business support provision for start-ups and SMEs that do not currently qualify for national programmes. SMEs can eventually progress to relevant national provision via an agreed referral process. The project will engage with new and growing SMEs across Northamptonshire, and is particularly targeted at supporting under-represented groups within disadvantaged areas of the county. ",01. Mrz 16,28. Feb 19,1431974,2887958,50%,NN2 7AL, Northamptonshire , England ,
Leicester and Leicestershire LEP,LLEP Technical Assistance Programme ERDF (2015-2018),ERDF,"This project will enhance the provision of services by approved providers through identifying the specific local needs relevant to the call for tenders as relevant to our local strategies. The project will enable the local ESIF Committee to support the Managing Authority to deliver their commitments at a local level. Through the deployment of technical and specialist knowledge, the assistance has been designed to enable improved connectedness between all of the constituent parts of the programme by supporting our partners and service providers to benefit from key learning, information and best practice to inform current as well as future policy direction for the ERDF provision and ultimately future LLEP strategies. ",01. Sep 15,31. Okt 18,315201,630409,50%,LE1 1FZ, Leicester and Leicestershire , England ,
University of Wolverhampton,Innovation Product Support Services,ERDF,The Innovative Product Support Service (IPSS) will offer support to businesses engaged in the development of new products.  The project is a follow-on from the successful IPSS project that has operated over the period 2013-2015 and has been refined in response to evaluation of the previous iteration of the programme. SME beneficiaries that are referred and accepted into the IPSS programme will receive a technical and commercial review of their product concept.,01. Apr 16,30. Apr 19,1256805,2393461,53%,WV1 1LY, Black Country , England ,
Coventry University Enterprises Ltd,Innovate to Succeed,ERDF,"Innovate2Succeed (i2s) will provide tailored support to SMEs to help them enhance their innovation management capability, resulting in increasing effectiveness in generating and commercially exploiting their ideas.  Beneficiaries will undergo an in depth diagnostic assessment of their business and a bespoke package of support will be then designed and delivered to embed innovation management capability within the company.  This improved capability will provide long-term benefit to the SME and the economy.   This activity forms part of a programme being delivered across 12 pilot LEPs as part of Innovate UKs agenda to increase innovation management capacity in UKs small businesses.",01. Apr 16,31. Mrz 19,500000,10000000,50%,CV1 2TT, Coventry and Warwickshire , England ,
University of Northampton,Innovate Northamptonshire (IN),ERDF,"The project will increase productivity, growth and competitiveness in Northamptonshires SMEs by unlocking their potential through innovation. Focussing on key priority sectors for the county, the scheme will build an innovation culture, giving SMEs the knowledge, skills and support they need to innovate. It will enhance links between Northamptonshire SMEs and experts in the UKs universities, and other sources of innovation and research expertise. This will address a historic serious under-performance in levels of innovation, investment in R&D, the adoption of ICT and patent applications.  The project will develop a cohort of businesses who are engaged in innovation.",01. Mrz 16,28. Feb 19,1186980,3247869,32%,NN2 7AL, Northamptonshire , England ,
Nottingham City Council,The D2N2 LEP Growth Hub,ERDF,"This project ensures the continued existence and further development of the Growth Hub information and referral service (Core Service), and enhances capabilities in several partner organisations so that an increasing number of businesses achieve their growth potential (Enhanced Local Service). The Growth Hub will continue to significantly improve take up of business support and hence competitiveness of D2N2 SMEs. The success of this bid will strengthen its position as the focal point of the D2N2 business support eco structure with at least 2,000 businesses per annum benefitting. This is fundamental as the D2N2 ESIF Call emphasises that all activity and delivery should be integrated with the Growth Hub.",01. Apr 16,31. Mrz 19,1272582,2545164,50%,NG2 3NG, D2N2 , England ,
Medilink East Midlands Limited,SOLSTICE- Smart Life Sciences Technology Innovation and Commecialisation,ERDF,"SoLSTICE  Smart life sciences technology & innovation commercialisation enabler is a strategically driven project that will deliver a range of activities that seek to engender a culture of innovation within the clinical technologies and life sciences sector.  The project has been developed to align with the national operational programme and the local LLEP economic strategy.  It seeks to address some key market failures and challenges identified by LLEP, including the lack of absorptive capacity for innovation; the lack of access to external knowledge; the challenge of accessing innovation active SMEs with growth potential; the need to boost entrepreneurial activity and increase the number of new businesses created; and the need to simplify access to innovation funding and support. ",01. Jan 16,31. Dez 18,500000,1000000,50%,NG1 1GF, Leicester and Leicestershire , England ,
Northamptonshire Enterprise Partnership,Delivering the Northamptonshire ERDF Technical Assistance Strategy,ERDF,"The project development aspect of this project will ensure that potential applicants are supported to develop projects in response to the ESIF strategy, implementation plan and relevant ERDF calls for projects.  It will ensure that projects are compliant with the requirements of the programme and support potential applicants to develop collaborative projects ensuring strategic alignment and ensuring best value for the local programme. This will also help to ensure that the programme meets its performance targets both in relation to expenditure and outputs.  This will be achieved through a series of workshops and events throughout the project period to ensure that opportunities are highlighted for potential applicants, so that pipeline ERDF projects and activities are developed in preparation to respond to future calls.",22. Jul 15,31. Mrz 18,200000,400000,50%,NN1 5DQ, Northamptonshire , England ,
Capital Enterprise,Capital Accelerate & Scale-up Tech Superstars (CASTS),ERDF,"Supporting high growth potential 'tech' businesses and brokering access to finance in London. 
Provides expert advice to SMEs looking to expedite growth through supporting SMEs' preparedness for investment and securing such investment via the creation of new Accelerator programmes in tech sectors such as fin tech/ed tech.  Vital to retaining London's position as tech capital of Europe. Provides significant added value in drawing in private leverage (£30m) at a ratio of 10:1 private/public sector.  Has strategic links to Tech City/Angel network and fills gap following withdrawal of BIS Growth Accelerator.  450 jobs to be created. ",01. Apr 16,30. Jun 19,3679577,7359154,50%,NW1 2SD, London , England ,
East London Small Business Centre,Enterprise for Everyone,ERDF,"Will increase levels of enterprise activity across London, with an emphasis on activity amongst under-represented groups, specifically supporting 40% women in business/ 40% ethnic minority-led businesses. Address barriers faced by existing businesses (under 42 months) supporting them to grow, ensuring higher levels of survival. 50 new jobs to be created. ",01. Jan 16,30. Jun 19,631267,1262534,50%,E1 7SA, London , England ,
University of York,(Multi-LEP) The Biovale Project,ERDF,Deliver a three year business support programme to help regional SMEs and larger businesses develop novel bio-based processes and products and build an internationally recognised innovation cluster.,03. Sep 15,30. Nov 18,1790000,3580000,50%,YO10 5DD, Leeds City Region and YNYER , England ,
Durham County Council,Business Energy Efficiency Project (BEEP),ERDF,"This project will provide support for SMEs on energy efficiency, renewable energy and business resilience to reduce greenhouse gas emissions and bottom line costs, enhancing competitiveness and supporting business growth.",01. Aug 16,31. Jul 19,533887,889811,60%,DH1 5UQ, North East , England ,
Cornwall Council ,Carluddon Technology Park,ERDF,"Site servicing to provide development plots extending to 2.8 ha; and the construction of 2,289 sq.m. of speculative employment space for advanced manufacturing.",15. Sep 16,01. Jul 21,6237000,8249000,76%,TR1 3AY, Cornwall and the Isles of Scilly , England ,
Cambridgeshire County Council,Connecting Cambridgeshire,ERDF,"Connecting Cambridgeshire has been allocated funding by government agency Broadband Delivery UK for a follow on phase to extend broadband deployment in Cambridgeshire and Peterborough. The Superfast Broadband Phase 2 funding is necessary to meet the governments 95% superfast broadband coverage target by 2017 and must be matched with local funding.
Connecting Cambridgeshires Phase 2 project will address the market failure in broadband deployment in an intervention area which was identified from a new Open Market Review concluded in Oct 2014 by Connecting Cambridgeshire.
",07. Aug 15,30. Dez 17,579246,1158492,50%,CB3 0AP, Greater Cambridge Greater Peterborough , England ,
Exemplas,Get Growing,ERDF,"The project will provide comprehensive support to mid sized SMEs with the latent potential to grow. The programme will consist of business advice, delivered by a team of specialist advisers, and integrated with a series of business workshops. Specialisms covered will include Sales & Marketing, Inward Investment, Finance, Productivity and Business Planning, with advisers working as a team to implement SME Growth Plans. The project will target SMEs who form part of the missing middle, those which were ineligible to access national business support and which can be the gazelles of future growth.",01. Jan 16,31. Mrz 18,724884,1449767,50%,AL7 3AX, Hertfordshire , England ,
Exemplas,Innovate to Succeed,ERDF,"Innovate2Succeed (I2S) will provide tailored support to SMEs to help them enhance their innovation management capability, resulting in increased effectiveness in generating and commercially exploiting their ideas. Beneficiaries will undergo an in-depth diagnostic assessment of their business and a bespoke package of support will then be designed and delivered to embed innovation management capability within the company. This improved capability will provide long-term benefit to the SME and the economy. This activity forms part of a programme being delivered across 13 pilot LEPs as part of InnovateUKs agenda to increase innovation management capacity in UKs small businesses.",01. Apr 16,31. Mrz 19,971724,1943448,50%,AL7 3AX, Hertfordshire , England ,
Creative England,ProConnect Hertfordshire,ERDF,"This programme will provide meaningful specialist support to SMEs working in or in the supply chain to the film and TV production industry as well as new market entrants to ensure they are well placed to start their own business. The programme will deliver a series of workshops and one-to-one interactions leading to economic growth for programme beneficiaries. These will deliver advice, support and guidance to help the companies plan better growth and new business strategies. They will also introduce the companies to industry buyers - at the appropriate level in the supply chain - to forge connections with new, potential customers and secure contracts.  The programme will also work in partnership with local college and university graduates to provide entrepreneurship and business ready start-up workshops.   Additionally the project will offer small grants to business to access specialist consultancy advice to support business growth.",01. Jul 16,30. Jun 19,500088,1000175,50%,Bs1 5SP, Hertfordshire , England ,
Innovation Birmingham,Birmingham Knowledge Economy Business Incubation Partnership,ERDF,"This project creates a partnership between Birminghams two science parks, providing accessible support for emerging innovative hi-tech SMEs, enabling a diversity of expertise and experience to be shared, driving focussed interventions targeted at companies with growth potential.  It will utilise access to both digital and life-science / wet-laboratory facilities and expertise at the two locations, the support of Entrepreneurs-In-Residence (sector and business development experts) and a wide community of associates, actively complementing the Growth Hub. It will enhance the survival and growth of regional hi-tech start-ups, promote innovation and investment by the regions SME base, and promote greater SME-Academia engagement.",01. Jan 16,31. Dez 18,1025489,2050978,50%,B7 4BB, Greater Birmingham and Solihull , England ,
Visit Peak District and Derbyshire,Growing and Developing the Visitor Economy Sector within Derbyshire,ERDF,"The project will support the capacity of SMEs in the visitor economy and its supply chains to grow in regional, national and international markets.  It will do this by: providing visitor economy sector specific business advice  and guidance; providing expertise and knowledge to enable visitor economy businesses access new and emerging markets that have been identified by Visit England; supporting the visitor economy to achieve economic growth within its domestic markets by aligning provision through the D2N2 Growth Hub. This is a partnership proposal led by Visit Peak District and Derbyshire (VPDD), supported by the Peak District National Park and D2 partners.",01. Mai 19,31. Mrz 19,743199,1486403,50%,S41 7NA, D2N2 , England ,
Worcestershire County Council,"Business Energy Efficiency Programme - Worcestershire, Herefordshire and Telford",ERDF,"This 3 year project continues and builds on the successful ERDF funded Resource Efficient Worcestershire (REW) programme.  It will provide energy efficiency advice and grant support to small and medium size businesses in Worcestershire, Herefordshire and Telford & Wrekin, enabling them to improve profitability, productivity and energy efficiency, whilst reducing carbon emissions and increasing take up of renewable energy.  The project will support 280 SMEs and achieve carbon reduction of at least 2,520 tonnes across these areas.  C. 140 grants for technical support &/or installation of energy efficiency and renewable energy measures will be provided.  Advice relating to water, waste and raw materials will also be given, where it can be shown that energy and carbon savings can be made.",01. Apr 16,31. Mrz 19,1105828,2211648,50%,WR5 2NP, Worcestershire , England ,
Warwickshire County Council,Coventry and Warwickshire SME Growth Programme - Warwickshire County Council,ERDF,"The project will deliver a package of activity designed to increase the number of new businesses; improve the sustainability of new businesses; tackle the underrepresentation of women in the digital creative sector; provide intensive business readiness support to businesses with the characteristics and ambition for growth; and attract businesses from CWLEPs priority sectors to the sub-region and help existing businesses to expand. In particular, it will:

	Support 324 new enterprises;
	Support 250 enterprises with their growth plans including 89 innovation-led and knowledge intensive SMEs;
	Create 294 new jobs.

The project is part of the Coventry and Warwickshire SME Growth Programme.",01. Jan 16,31. Dez 18,1623934,3247869,50%,CV34 4SX, Coventry and Warwickshire , England ,
East Midlands Business Limited,D2N2 SME Growth and Innovation programme,ERDF,"The D2N2 Growth and Innovation Programme will help to stimulate economic growth, employment and innovation in the D2N2 area by providing grants to small and medium enterprises that want to grow, innovate and create sustainable new employment. The D2N2 Growth & Innovation Programme brings together three grant schemes that between them cover the whole of the D2N2 area: University of Derby Invest to Grow Programme; University of Nottingham N2 Business Growth Programme and D2 Enterprise Growth Fund. ERDF funding will increase the number of grants that can be awarded by these partner grant schemes and provide resources to assist businesses to make applications.",01. Jan 16,31. Dez 17,5379509,10979509,50%,LE19 1RJ, D2N2 , England ,
Greater Lincolnshire LEP,ERDF Technical Assistance,ERDF,"The project aims to: deliver a technical assistance package, generating and underpinning a Greater Lincolnshire focus, throughout the ESIF programme; increase understanding and knowledge of the programme and activity calls, whilst also providing practical support to projects within the ESIF Process and provide a co-ordinated approach to delivery; drawing in expertise from sector specialists/strategic review groups to ensure good quality bids come forward from Greater Lincolnshire.  This promotes ERDF opportunities via calls for activity, ensuring compliance, generating a pipeline set of proposals that contributes to successfully delivering the GL LEP ESIF Strategy and ERDF Operational Programme.",01. Jan 16,31. Dez 18,251364,418938,50%,NG5 9RG, Greater Lincolnshire , England ,
Birmingham Science Park Aston,Innovation Engine,ERDF,"The Innovation Engine simulates demand for new or improved products, services, and processes by issuing challenges to SME businesses from large organisations operating within the Health, Life Sciences, Digital & Creative, Transport and Low Carbon sectors to drive smart, sustainable and inclusive growth via the SMEs.
The project increases SME investment in research and innovation by stimulating new markets, resulting in new products, services and processes by enabling the businesses to collaboratively solve the challenges. 
The SMEs will be engaged in knowledge exchange, collaborative and contract research and innovation in conjunction with Universities, research institutions, public institutions and large enterprises.",04. Jan 16,31. Dez 18,1839354,1629910,50%,B7 4BB, Greater Birmingham and Solihull , England ,
Coventry City Council,Innovative Coventry and Warwickshire: Place Test Bed,ERDF,"This project will ensure that the benefits of innovation and new technology are felt in the local economy of Coventry and Warwickshire. The areas urban and rural centres will be used as test-beds for emerging technologies in the fields of data capture, energy usage, IT connectivity, smart systems, digital technology and health and assistive technologies.

This activity will encourage collaboration between the knowledge base, innovative businesses and local authorities, and support SMEs to develop, test and market new products. It will also demonstrate the benefits of new technology to local decision-makers to ensure it is adopted more quickly.",01. Jan 16,31. Dez 18,1759786,5186242,34%,CV1 5RR, Coventry and Warwickshire , England ,
Herefordshire Council,Marches Building Investment Grant,ERDF,"The Marches Building Investment Grant will provide capital grants to SMEs ranging from £4,500 to £100,000 (up to 45% of total project costs) to refurbish, reconfigure and extend commercial premises in the Marches LEP area. Grant assistance will also be offered to qualifying landlords and tenants wishing to bring redundant buildings back into economic use (providing the end users are in the ERDF eligible categories). This Programme builds on the success of the current £3m Redundant Building Grant Scheme, funded via Regional Growth Fund, which is on target to achieve full spend by May 2016 and profiled outputs.   The MBIG Programme will achieve job creation, support SME growth and expansion, improve commercial workspace, increase productivity and provide assistance with diversification.",01. Okt 16,30. Sep 19,2825873,5905383,48%,HR4 0LE, The Marches , England ,
University of Warwick,Product Innovation Accelerator,ERDF,"Product Innovation Accelerator will enable SMEs to participate in Research and Development (R&D) and create, test and demonstrate new marketable products that are based on new technology and applications. It will boost R&D capacity and capability in SMEs by taking ideas and accelerating them into commercial outcomes. The project will leverage the activities of the WMG centre High Value Manufacturing Catapult, capitalising on its strengths in low carbon mobility including accessing Systems, Materials and Product workstreams.  It will address market led technology challenges exploiting market opportunities unlocking SME potential using a proven delivery model that works for SMEs.",01. Aug 15,31. Mrz 19,1161463,2322926,50%,CV4 7AL, Coventry and Warwickshire , England ,
