ANTRAGSNUMMER,Interventionskategorie,Name des Begünstigten,PLZ,BEGINN,ENDE,ZUSAMMENFASSUNG,BEZEICHNUNG,GESAMTBETRAG 1)
diverse,104.0,ExistenzgründerInnen/ 800 Personen,o.A.,01-01-2014,31-12-2020,Qualifizierung und Coaching für ExistenzgründerInnen,"Beratung f. Existenzgründung, Sicherung, Training & Coaching",575160.34
ESF/14-WM-A32-0010/15-A01,104.0,BilSE - Institut für Bildung und Forschung GmbH,18273,05.02.16,31.07.16,Förderung von Entrepreneurship,"Flankierende Unterstützung der Initiative ""Schülerfirmen in MV"" durch Fortbildung von Lehrpersonal zur zielgerichteten Gründung von Schülerfirmen in den Schulen Mecklenburg Vorpommerns.",11998.95
ESF/14-WM-A32-0004/15-A01,104.0,Allgemeiner Unternehmensverband Neubrandenburg e.V.,17033,12.04.16,31.03.18,Förderung von Entrepreneurship,"Betrieb und Weiterentwicklung der Webseite ""www.gruender-mv.de"" mit dem Ziel der Sensibilisierung für Fragen der Unternehmensgründung sowie der Information von Existenzgründern und Unternehmen.",497444.57
ESF/14-WM-A32-0008/15-A01,104.0,BilSE - Institut für Bildung und Forschung GmbH,18273,05.02.16,31.07.16,Förderung von Entrepreneurship,"Förderung der Motivation von SchülerInnen, eine Schülerfirma zu gründen. Begleitung der Schüler bei Neugründungen, Betreuung bereits bestehender Schülerfirmen sowie Unterstützung von Netzwerkbildung mit anderen Schülerfirmen und der Wirtschaft.",45024.15
ESF/14-WM-A32-0011/15,104.0,"Ministerium für Bildung, Wissenschaft und Kultur M-V",19055,14.12.15,31.07.17,Förderung von Entrepreneurship,"Inhaltliche und konzeptionelle Begleitung von Rahmenlehrplan und Weitbildungskonzept mit dem Ziel der stärkeren Verankerung von Entrepeneurship und Schülerfirmen in die Schulen des Landes Mecklenburg-Vorpommern.
Begleitung eines Modellvorhabens zur Erprobung der des veränderten Rahmenplans im Fach AWT mit dem Ziel, Auswirkungen auf mögliche Schülerfirmen zu bewerten.
Vorbereitung für die Übernahme der Internetplattform für Schülerfirmen durch das Ministerium für Bildung, Wissenschaft und Kultur.
Mitwirkung bei der Weiterentwicklung des Landeskonzepts zum Übergang von der Schule in den Beruf unter Beachtung von Entrepeneurship in Form von Schülerfirmen.",153438.22
ESF/14-WM-A32-0019/15,104.0,Fachhochschule Stralsund,18435,21.06.16,31.12.19,Förderung von Entrepreneurship,"Durchführung des lokalen Ideenwettbewerbs an der Hochschule Stralsund im Rahmen des Landeshochschulwettbewerbs ""Inspired"".",181128.06
ESF/14-WM-A32-0001/15-A01,104.0,ÜAZ Überregionales Ausbildungszentrum Waren/Grevesmühlen e.V.,17192,05.02.16,31.07.16,Förderung von Entrepreneurship,"Förderung der Motivation von SchülerInnen, eine Schülerfirma zu gründen. Begleitung der Schüler bei Neugründungen, Betreuung bereits bestehender Schülerfirmen sowie von Netzwerkbildung mit anderen Schülerfirmen und der Wirtschaft.",27785.6
ESF/14-WM-A32-0006/15-A01,104.0,Bildungswerk der Wirtschaft Mecklenburg-Vorpommern e.V.,19053,05.02.16,31.07.16,Förderung von Entrepreneurship,"Förderung der Motivation von SchülerInnen, eine Schülerfirma zu gründen. Begleitung der Schüler bei Neugründungen, Betreuung bereits bestehender Schülerfirmen sowie Unterstützung von Netzwerkbildung mit anderen Schülerfirmen und der Wirtschaft.",54268.83
ESF/14-WM-A32-0007/15-A01,104.0,Hochschule Wismar,23966,05.02.16,31.03.18,Förderung von Entrepreneurship,"Gezielte Ansprache und Sensibilisierung von Studierenden für wirtschaftsnahe interdisziplinäre Projekte, Begleitung der Studierenden bei der Umsetzung der Projekte und Stärkung des unternehmerischen Denkens an der Hochschule Wismar.",291459.8
ESF/14-WM-A32-0017/15-A01,104.0,Agentur für Technologietransfer und Innovationsförderung GmbH,19061,14.07.16,31.12.18,Förderung von Entrepreneurship,"Qualifizierung, Beratung und Unterstützung von technologieorientierten und wissensbasierten Unternehmensgründungen im Umfeld der Technologiezentren in Schwerin, Rostock und Greifswald unter Einbeziehung der Standorte Wismar, Stralsund und Neubrandenburg.",911892.18
ESF/14-WM-A32-0021/15,104.0,Ernst-Moritz-Arndt-Universität Greifswald,17487,03.06.16,31.12.19,Förderung von Entrepreneurship,"Durchführung des lokalen Ideenwettbewerbs an der Universität Greifswald (UNIQUE) im Rahmen des Landeshochschulwettbewerbs ""Inspired"".",339966.74
ESF/14-WM-A32-0003/15,104.0,"Regionale Arbeitsstelle für Bildung, Integration und Demokratie M-V e.V. (RAA)",17192,15.12.15,31.07.16,Förderung von Entrepreneurship,"Förderung der Motivation von SchülerInnen, eine Schülerfirma zu gründen. Begleitung der Schüler bei Neugründungen, Betreuung bereits bestehender Schülerfirmen sowie Unterstützung von Netzwerkbildung mit anderen Schülerfirmen und der Wirtschaft. Förderung der Weiterentwicklung und Verstetigung der Projekte über das Schuljahr 2015/2016 hinaus.",73889.11
ESF/14-WM-A32-0015/15,104.0,Hochschule Neubrandenburg,17033,20.04.16,31.12.19,Förderung von Entrepreneurship,"Durchführung des lokalen Ideenwettbewerbs an der Hochschule Neubrandenburg im Rahmen des Landeshochschulwettbewerbs ""Inspired"".",157001.67
ESF/14-WM-A32-0002/15-A01,104.0,"Regionale Arbeitsstelle für Bildung, Integration und Demokratie M-V e.V. (RAA)",17192,05.02.16,31.12.17,Förderung von Entrepreneurship,"Unterstützung von jungen Menschen im Alter unter 30 Jahren bei der Gründung eines eigenen Unternehmens. Zielgruppen sind insbesondere junge Eltern, Alleinerziehende, Arbeitslose bzw. von Arbeitslosigkeit bedrohte. Bei ca. 45 jungen Menschen soll die Beratung in einer neuen Unternehmensgründung münden. Bereits im Projekt betreute junge Unternehmensgründer sollen auf Anfragen weiterhin beraten werden.",299186.27
ESF/14-WM-A32-0009/15-A01,104.0,Forschungs-GmbH Wismar,23966,05.02.16,31.12.18,Förderung von Entrepreneurship,"Ca. 30 Master Studierende der Studiengänge ""Internationales Marketing"" und ""Strategisches Design"" werden innerhalb der Lehrveranstaltungen der Sommersemester befähigt, für regionale Unternehmen internationale Messekonzepte zu entwickeln. Die Studierenden erfahren dabei am konkreten Beispiel die Bedeutung des unternehmerischen Denkens.",111342.67
ESF/14-WM-A32-0005/15,104.0,Forschungsverbund Mecklenburg-Vorpommern e.V.,18059,10.08.15,09.08.18,Förderung von Entrepreneurship,Information zu akademischen oder forschungsbasierten Gründungsmöglichkeiten sowie die Generierung von 150 Verwertungsideen (Scouting). In der Maßnahme werden Gründungsideen begleitet und beraten. Es sollen 15 Gründungsideen zur Unternehmungsgründung geführt werden.,674909.52
ESF/14-WM-A32-0020/15,104.0,Universität Rostock,18051,05.04.16,31.12.19,Förderung von Entrepreneurship,"Durchführung des lokalen Ideenwettbewerbs an der Universität Rostock im Rahmen des Landeshochschulwettbewerbs ""Inspired"" sowie dessen fachliche Koordinierung. Fachliche Koordinierung des Ideenwettbewerbs an den außeruniversitären Forschungseinrichtungen. Durchführung des landesweiten Wettbewerbs.",1038730.55
ESF/14-WM-A32-0016/15,104.0,Hochschule Wismar - Der Kanzler -,23952,02.05.16,31.12.19,Förderung von Entrepreneurship,"Durchführung des lokalen Ideenwettbewerbs an der Hochschule Wismar im Rahmen des Landeshochschulwettbewerbs ""Inspired"".",169027.14
ESF/14-WM-A32v-0001/15,104.0,"Formtreu Potsdam, Ines Schneider + Peter Jaworskyj GbR",14469,22.07.15,31.03.18,Förderung von Entrepreneurship,"Förderung von Entrepreneurship in Mecklenburg-Vorpommern, insbesondere für die Gründung von wissensintensiven und innovatioven Unternehmen.",196350.0
ESF/14-WM-A33-0007/16,104.0,anonym,18057,08.03.16,30.09.17,Gründungsstipendien,"Beihilfe zum Lebensunterhalt für eine innovative, technologieorientierte und wissensbasierte Unternehmensgründung unter der Firma INNOPROOF GmbH, deren Gegenstand die physikalische, mechanische Prüfung an nicht aktiven medizinischen Produkten, die Entwicklung von Prüfverfahren, Schadensanalysen, Entwicklungsdienstleistungen, Beratungsleistungen sowie alle damit in Zusammenhang stehenden Dienstleistungen ist.",27000.0
ESF/14-WM-A33-0004/15,104.0,anonym,18439,16.02.16,31.10.17,Gründungsstipendien,"Beihilfe zum Lebensunterhalt für eine innovative, technologieorientierte und wissensbasierte Unternehmensgründung zur „Entwicklung, Herstellung und Vertrieb von Geräten und Software zur automatisierten Erfassung und Auswertung von Daten in Industrie und Gesundheitswesen mit dem Ziel der Verbesserung der Hygiene und der Optimierung von Arbeitsabläufen“ unter der Firma GWA Hygiene GmbH ",21600.0
ESF/14-WM-A33-0009/16,104.0,anonym,18059,11.08.16,30.04.18,Gründungsstipendien,"Beihilfe zum Lebensunterhalt für eine innovative, technologieorientierte und wissensbasierte Unternehmensgründung unter der Firma GetVise GmbH gewährt, deren Gegenstand insbesondere die Erbringung von Dienstleistungen im Bereich der internetbasierten Marktforschung auf Basis der Social Crowd-Plattform GetVise ist.
",25200.0
ESF/14-WM-A33-0002/15,104.0,anonym,18057,09.12.15,31.03.17,Gründungsstipendien,"Beihilfe zum Lebensunterhalt für eine innovative, technologieorientierte und wissensbasierte Unternehmensgründung zur „Entwicklung von Software als Medizinprodukt, speziell für die Humangenetik“ unter der Firma „Limbus Medical Technologies GmbH“ ",25200.0
ESF/14-WM-A33-0010/16,104.0,anonym,18069,11.08.16,30.04.18,Gründungsstipendien,"Beihilfe zum Lebensunterhalt für eine innovative, technologieorientierte und wissensbasierte Unternehmensgründung unter der Firma GetVise GmbH , deren Gegenstand insbesondere die Erbringung von Dienstleistungen im Bereich der internetbasierten Marktforschung auf Basis der Social Crowd-Plattform GetVise ist.
",28800.0
ESF/14-WM-A33-0003/15,104.0,anonym,18059,16.02.16,31.08.17,Gründungsstipendien,"Beihilfe zum Lebensunterhalt für eine innovative, technologieorientierte und wissensbasierte Unternehmensgründung zur „Entwicklung und Vertrieb medizinischer Funktionswäsche“ unter der Firma Medi-Tex Medizinische Funktionswäsche",25200.0
ESF/14-WM-A33-0008/15,104.0,anonym,18439,16.02.16,31.08.17,Gründungsstipendien,"Beihilfe zum Lebensunterhalt für eine innovative, technologieorientierte und wissensbasierte Unternehmensgründung zur „Herstellung von Sportgeräten (Longboards) unter Verwendung von neuartigen Pressverfahren, Formgestaltung und alternativen Faser- und Verbundstoffen“ unter der Firma „Drüding und Mersmann GbR (Treibholz Boards)“ ",21600.0
ESF/14-WM-A33-0008/16,104.0,anonym,18055,23.03.16,31.08.17,Gründungsstipendien,"Beihilfe zum Lebensunterhalt für eine innovative, technologieorientierte und wissensbasierte Unternehmensgründung unter der Firma SMACON GmbH , deren Geschäftszweck insbesondere die Entwicklung und der Vertrieb der Applikation „SMACON Yacht“, einer Software für mobile Endgeräte zur Erleichterung der Organisation des Unterhalts, der Ausrüstung und der sicherheitsrelevanten Ablaufe an Bord von Yachten ist.",21600.0
ESF/14-WM-A33-0005/15,104.0,anonym,17493,16.02.16,31.10.17,Gründungsstipendien,"Beihilfe zum Lebensunterhalt für eine innovative, technologieorientierte und wissensbasierte Unternehmensgründung zur „Entwicklung, Herstellung und Vertrieb von Geräten und Software zur automatisierten Erfassung und Auswertung von Daten in Industrie und Gesundheitswesen mit dem Ziel der Verbesserung der Hygiene und der Optimierung von Arbeitsabläufen“ unter der Firma „GWA Hygiene GmbH“ ",21600.0
ESF/14-WM-A33-0007/15,104.0,anonym,18439,08.04.16,30.09.17,Gründungsstipendien,"Beihilfe zum Lebensunterhalt für eine innovative, technologieorientierte und wissensbasierte Unternehmensgründung zur Herstellung von Sportgeräten (Longboards) unter Verwendung von neuartigen Pressverfahren, Formgestaltung und alternativen Faser- und Verbundstoffen unter der Firma Drüding und Mersmann GbR (Treibholz Boards) ",21600.0
ESF/14-WM-A33-0011/16,104.0,anonym,18147,11.08.16,30.04.18,Gründungsstipendien,"Beihilfe zum Lebensunterhalt für eine innovative, technologieorientierte und wissensbasierte Unternehmensgründung unter der Firma GetVise GmbH, deren Gegenstand insbesondere die Erbringung von Dienstleistungen im Bereich der internetbasierten Marktforschung auf Basis der Social Crowd-Plattform GetVise ist.
",28800.0
ESF/14-WM-A33-0001/15,104.0,anonym,18069,09.12.15,31.01.17,Gründungsstipendien,"Beihilfe zum Lebensunterhalt für eine innovative, technologieorientierte und wissensbasierte Unternehmensgründung zur „Entwicklung von Software als Medizinprodukt, speziell für die Humangenetik“ unter der Firma „Limbus Medical Technologies GmbH“ ",25200.0
ESF/14-SM-A41-0001/16,105.0,Hochschule Wismar,23966,22.02.16,31.12.18,Förderung der Gleichstellung der Geschlechter,"KarriereStartMentoring in M-V –Erhöhung der Aufstiegschancen und Verbesserung der Vereinbarkeit von Erwerbs- und Privatleben für Studentinnen der Hochschule Wismar auf dem Weg in Fach- und Führungspositionen durch individuelle Förderung, Beratung und Unterstützung unter Berücksichtigung der folgenden Maßnahmen:  
a)	Entwicklung und Durchführung von Mentoringprogrammen für Studentinnen aus den Fakultäten:
- Ingenieurwissenschaften
- Wirtschaftswissenschaften
- Gestaltung
Die zu erreichende Tandemzahl wird für das Mentoring-Programm auf 15 – 20 Tandempaare pro Durchgang festgelegt.
 b)	Erweiterung der Infrastruktur/Öffentlichkeitsarbeit und Verstetigung des Projektes in der regionalen Unternehmens- und Hochschullandschaft, Gewinnung von Multiplikatoren durch hochschulinterne Kooperationen, Bindung von Mentorinnen und Mentoren, Gründung eines Empfehlungssystems innerhalb der Hochschule
c)	Nachhaltige Vernetzung durch Förderung von Kommunikation, Austausch und Netzwerkbildung unter Studentinnen und Hochschulabsolventinnen (Mentee-Gruppen)
d)	Aufbau von Mentoringbeziehungen mit Unternehmerinnen und Unternehmern aus der Wirtschaft zur Förderung der Karriere von Studentinnen und Hoch-schulabsolventinnen der Hochschule Wismar
e)	Weiterentwicklung und Durchführung von Seminaren, Messen und Karrierebe-ratung
f)	Begleitung, Beratung und Koordination von Tandems
g)	Einbindung des Programms in Strukturen der Hochschule Wismar und Imple-mentierung in den Karriereservice der Hochschule Wismar
h)	Kooperation mit der Hochschule Neubrandenburg und der Fachhochschule Stralsund",238621.27
ESF/14-SM-A41-0005/15,105.0,Universität Rostock,18051,16.12.15,31.12.18,Förderung der Gleichstellung der Geschlechter,"KarriereWegeMentoring – Erhöhung der Aufstiegschancen und Verbesserung der Vereinbarkeit von Erwerbs- und Privatleben für Frauen aus dem Wissenschaftskontext der Universität Rostock in Kooperation mit der Ernst-Moritz-Arndt-Universität Greif-wald durch folgende Maßnahmen:
a)	Entwicklung und Durchführung von Mentoringprogrammen für die Zielgruppen:
-	Postdoktorandinnen und Juniorprofessorinnen
-	Doktorandinnen
-	Peer-Mentoring: „Option Promotion“
Die zu erreichende Tandemzahl wird für die Mentoring-Programme folgenderma-ßen festgelegt:
a.	Doktorandinnen-Mentoring: 		mind. 24 Tandems
b.	Postdoktorandinnen-Mentoring: 	mind. 20 Tandems
c.	Peer-Mentoring: 			mind. 20 Teilnehmerinnen
b)	Entwicklung, Konzeption und Durchführung von Veranstaltungen zur Verein-barkeit von Familie und Beruf
c)	Durchführung von Veranstaltungen zur Karriereorientierung
d)	Entwicklung eines Alumnae-Konzeptes zur langfristigen Nutzung von Mentoring-Netzwerken und Einbindung der Alumnae in strategische Aufgaben zur Weiterentwicklung von Konzepten in dem Bereich Mentoring oder Verbes-serung der Vereinbarkeit; sowie Unterstützung bei der inhaltlichen Umsetzung von Informations- und Auftaktveranstaltungen",387561.37
ESF/14-SM-A41-0010/16,105.0,Bildungswerk der Wirtschaft gGmbH,19417,02.03.16,31.12.17,Förderung der Gleichstellung der Geschlechter,Zukunft durch Aufstieg - Cross-Mentoring in der Region Vorpommern Rügen und nördliches Vorpommern-Greifswald zur Erhöhung der beruflichen Aufstiegschancen von weiblichen Führungskräften in Führungspositionen in Unternehmen oder in Füh-rungspositionen in Institutionen mit wirtschaftsnahen Strukturen. Die zu erreichende Tandemzahl wird für das Mentoring-Programm auf mindestens 8 Tandempaare festge-legt.,89694.77
ESF/14-SM-A41-0004/15,105.0,BilSE - Institut für Bildung und Forschung GmbH,18273,16.12.15,31.07.17,Förderung der Gleichstellung der Geschlechter,"Pro-Fe-Ma – Das Projekt leistet einen Beitrag zur stärkeren Überwindung von Rollen-stereotypen, um geschlechtsspezifische Berufswahlmuster aufzuweichen und Schüler an die Berufsfelder Gesundheit und Soziales, sowie junge Schülerinnen an die MINT-Berufe heranzuführen mit dem Ziel die SchülerInnen auf den Übergang in ein/e ent-sprechende Ausbildung oder Studium vorzubereiten. Es sollen folgende Teilziele er-reicht werden:
a)	Die teilnehmenden SchülerInnen sollen über die aktuellen Berufsbilder, Ausbil-dungs – und Studienwege in den MINT- bzw. Gesundheits- und Sozialberei-chen und den dazugehörigen Zugangsvoraussetzungen im Rahmen von Workshops und Seminaren informiert werden.
b)	Den teilnehmenden SchülerInnen soll durch Kompetenzfeststellungen und Pro-filanalyse die Möglichkeit gegeben werden, die eigenen Kompetenzen, Interes-sen und Fähigkeiten zu erkennen und auszubauen.
c)	Entwicklung, Konzeption und Durchführung von Seminaren/Workshops zum Abbau von Rollenstereotypen und zur Verdeutlichung von Gleichstellung und Vereinbarkeit in den Unternehmen aus dem MINT-Bereich und dem Gesund-heits- und Sozialwesen mit dem Ziel die verantwortlichen Akteure für eine Be-rufsorientierung bzw. das geschlechtsunabhängige Berufswahlverhalten zu sensibilisieren.
d)	In den Unternehmen sollen Handlungsstrategien praktisch umgesetzt werden, die Schülerinnen und Schüler durch die Projektarbeit an die Berufe heranfüh-ren.",260883.48
ESF/14-SM-A41-0007/16,105.0,Landesfrauenrat Mecklenburg-Vorpommern e.V.,18055,18.02.16,31.12.17,Förderung der Gleichstellung der Geschlechter,"Trägerschaft des „Landeszentrums für Gleichstellung und Vereinbarkeit“ für das Land Mecklenburg-Vorpommern mit folgenden Zielen: 
a.)	Unterstützung der Landesregierung bei der Implementierung, Umsetzung, Eva-luierung und Weiterentwicklung des Querschnittsziels Gleichstellung in den verschiedenen Förderbereichen des Europäischen Sozialfonds sowie bei der Umsetzung von weiteren Maßnahmen zur Erhöhung der Akzeptanz und Sen-sibilität für gleichstellungs- und vereinbarkeitsspezifische Themen insbeson-dere durch:
a.	Analyse von Rahmenbedingungen für Frauen und Männer im Zusam-menhang mit den spezifischen Förderbereichen des Operationellen Pro-gramms des ESF 
b.	Entwicklung von Instrumenten und Methoden zur Umsetzung der Gleichstellung als Querschnittsziel
c.	Durchführung von Gender-Coachings mit den an der Programmkonzep-tion und -umsetzung beteiligten Stellen und weiteren Akteuren
d.	Erstellung von Leitfäden zu zentralen Gleichstellungsmaßnahmen 
e.	Maßnahmen der Öffentlichkeitsarbeit in Abstimmung mit dem Ministeri-um für Arbeit, Gleichstellung und Soziales 
f.	Mitwirkung in der Steuerungsgruppe „Gleichstellung von Frauen und Männern im ESF“
b.)	Entwicklung, modellhafte Erprobung und Evaluation einer gleichstellungs- und vereinbarkeitsfördernden Expertise im Dienstleistungsbereich „Bausteintool Arbeitsorganisation“ in den Regionen Hansestadt Rostock, Landkreis Ros-tock und Landkreis Mecklenburgische Seenplatte mit folgenden vor- und nachbereitenden Elementen:
a.	Aufbau eines „Arbeitskreises VEP Dienstleistung“ mit den regionalen Sozialpartnern als Expertinnen und Experten in ihren Wirkungskreisen mit der Funktion als Multiplikatoren 
...",474573.93
ESF/14-SM-A41-0005/16,105.0,RWI Regionale Wirtschaftsinitiative - Ost Mecklenburg-Vorpommern e.V.,17033,02.03.16,31.12.17,Förderung der Gleichstellung der Geschlechter,Zukunft durch Aufstieg - Cross-Mentoring in den Regionen Vorpommern-Greifswald und Mecklenburgische Seenplatte zur Erhöhung der beruflichen Aufstiegschancen von weiblichen Führungskräften in Führungspositionen in Unternehmen oder in Füh-rungspositionen in Institutionen mit wirtschaftsnahen Strukturen. Die zu erreichende Tandemzahl wird für das Mentoring-Programm auf mindestens 10 Tandempaare fest-gelegt.,139999.73
ESF/14-SM-A41-0008/16,105.0,GiB mbH - Gesellschaft für innovative Beschäftigung,19288,22.02.16,31.12.17,Förderung der Gleichstellung der Geschlechter,Zukunft durch Aufstieg - Cross-Mentoring in dem Landkreis Ludwigslust-Parchim und der Landeshauptstadt Schwerin zur Erhöhung der beruflichen Aufstiegschancen von weiblichen Führungskräften in Führungspositionen in Unternehmen oder in Füh-rungspositionen in Institutionen mit wirtschaftsnahen Strukturen. Die zu erreichende Tandemzahl wird für das Mentoring-Programm auf 12 Tandempaare festgelegt.,85190.6
ESF/14-SM-A41-0002/16,105.0,BilSE - Institut für Bildung und Forschung GmbH,18273,22.02.16,31.12.17,Förderung der Gleichstellung der Geschlechter,Zukunft durch Aufstieg - Cross-Mentoring in dem Landkreis Nordwestmecklenburg und der Landeshauptstadt Schwerin zur Erhöhung der beruflichen Aufstiegschancen von weiblichen Führungskräften in Führungspositionen in Unternehmen oder in Füh-rungspositionen in Institutionen mit wirtschaftsnahen Strukturen. Die zu erreichende Tandemzahl wird für das Mentoring-Programm auf 24 Tandempaare festgelegt.,222683.76
ESF/14-SM-A41-0001/15,105.0,Landesfrauenrat Mecklenburg-Vorpommern e.V.,18055,29.10.15,31.07.17,Förderung der Gleichstellung der Geschlechter,"Zeit im Zentrum – Mit dem Projekt sollen neue Impulse für die MV-spezifische Beförde-rung der Gleichstellung von Frauen und Männern sowie der Vereinbarkeit von Er-werbs- und Privatleben hervorgebracht werden, dabei erfolgt eine Fokussierung in den Schwerpunktfeldern:
a.)	Geschlechtsspezifische Zeitverwendung im Lebenslauf:
Generierung MV-spezifischer Befunde und Entwicklung von Handlungsansät-zen und Vorschlägen zur Erfolgsmessung der Umsetzung von Gleichstellung in M-V mit dem Ziel die Angleichung des Arbeitszeitvolumens von Männern und Frauen (bezogen auf Erwerbs- und Familienarbeit) zu befördern,
b.)	Arbeitszeitgestaltung mit dem Fokus auf Zeitautonomie:
Beteiligungsorientierte Entwicklung konkreter Arbeitszeitmanagementlösungen für Betriebe mit Präsenzarbeitsplätzen im Rahmen eines Praxisprojekts und Er-stellung und Bereitstellung einer Expertise zu Arbeitszeitmodellen, Arbeitszeit-organisationen und Zeitautonomieumsetzung für MV-spezifische Branchen und Betriebs- und Organisationsgrößen. Konzeption und Begleitung des Prozesses zur Etablierung einer Arbeitszeitberatung für Betriebe.
c.)	Zeitkonkurrenz(situationen):
Entwicklung und Verbreitung von einfachen, leicht realisierbaren Lösungen für Zeitkonfliktsituationen durch die Erstellung eines Handlungsleitfadens zur Zeit-konkurrenz-Handlungsfeldern und Praxisansätzen sowie Durchführung von Praxistransferworkshops.",431614.34
ESF/14-SM-A41-0006/16,105.0,UdW Gesellschaft für Dienstleistung und Beratung- Unternehmensberatung der Wirtschaft,17033,22.02.16,31.12.17,Förderung der Gleichstellung der Geschlechter,"Umsetzung der Landeskoordinierung für das Programm „Zukunft durch Aufstieg- Mentoring für weibliche Nachwuchsführungskräfte in Mecklenburg-Vorpommern unter Berücksichtigung folgender Aufgaben:1.	Wissenschaftliche Begleitung des Mentoring-Programms
2.	Begleitende Beratung und Steuerung der Projektbeteiligten
3.	Koordination und Vernetzung der regionalen Cross-Mentoring-Projekte
4.	Monitoring und Berichtspflicht
5.	Organisation und Durchführung der Einführungsveranstaltungen für Mentees und Mentoren/Mentorinnen der regionalen Cross-Mentoring-Projekte
6.	Organisation der landesweiten Netzwerkveranstaltungen
7.	Konzeption des Weiterbildungsprogramms auf Landesebene
8.	Qualitätssicherung und Wissenstransfer
9.	Organisation und Durchführung der Arbeitskreise Mentoring
10.	Öffentlichkeitsarbeit",215969.96
ESF/14-SM-A41-0003/15,105.0,Frauenbildungsnetz Mecklenburg-Vorpommern e.V.,18055,16.12.15,31.08.17,Förderung der Gleichstellung der Geschlechter,"Mentoring Kunst – Ziel des Projektes ist Künstlerinnen und Autorinnen in Mecklen-burg-Vorpommern am Beginn ihrer beruflichen Selbstständigkeit durch berufserfah-rene Künstlerinnen mit ihren spezifischen Arbeitsprozessen und – abläufen kompetent in Kunstmarkt und Kulturbetrieb einzuführen und sich als selbstständige Künstle-rinnen auf dem Arbeitsmarkt Kunst zu positionieren. Es soll wirksam zu einer Profes-sionalisierung der teilnehmenden Künstlerinnen auf beruflicher, künstlerischer und wirtschaftlicher Ebene beitragen. Das Projekt setzt sich aus folgenden Elementen zu-sammen:
a)	Mentoring zur Vermittlung eines fachlich fundierten, professionellen Erfah-rungsaustausches
    Die zu erreichende Tandemzahl wird für das Mentoring-Projekt auf mind. 12
    Tandems festgelegt
b)	Durchführung von Fachveranstaltungen zum Themenfeld „Kunstmanagement kompakt – Fachwissen & KnowHow für den Berufsalltag“
c)	Aufbau eines Kompetenznetzwerkes aus Fachleuten und Expert/innen aus Kunstbetrieb und Kunstmarkt",208653.74
