ANTRAGSNUMMER,Interventionskategorie,Name des Begünstigten,PLZ,BEGINN,ENDE,ZUSAMMENFASSUNG,BEZEICHNUNG,GESAMTBETRAG 1)
ESF/14-SM-B12p-0031/15,109.0,Fortbildungsakademie der Wirtschaft (FAW) gGmbH,18069,27.10.15,31.10.17,"Stärkung von Familie, insbesondere familienorientiertes Fallmanagement und Familiencoach im Quartier","""INTEGRO - Männercoaching"" Maßnahmen zur Befähigung der teilnehmenden Männer zur Annahme von Hilfemöglichkeiten zur gesundheitlichen Stabilisierung und Entwicklung marktnaher Tagesstrukturen mit dem Ziel, einen verbesserten Zugang der Teilnehmenden zum Arbeitsmarkt zu schaffen",329335.49
ESF/14-SM-B12p-0019/16,109.0,Ausbildungsförderungszentrum Friedland e. V. (AFZ),17098,27.07.16,31.07.17,"Stärkung von Familie, insbesondere familienorientiertes Fallmanagement und Familiencoach im Quartier","Familiencoachprojekt II ""PASSGENAU"" in Demmin und Malchin - Die Teilnehmer/Familien sollen befähigt werden, ihre individuelle Situation ganzheitlich zu erfassen, um eine Verbesserung und Stabilisierung der familiären Verhältnisse sowie der Gesamtsituation anzustreben. Die Förderung einer berufsorientierten Tagesstruktur sowie die Erhöhung der Beschäftigungsfähigkeit bis hin zur Arbeitsaufnahme stehen im Fokus der Maßnahme.",82566.47
ESF/14-SM-B12p-0009/15,109.0,Ausbildungsförderungszentrum Friedland e. V. (AFZ),17098,07.07.15,29.02.16,"Stärkung von Familie, insbesondere familienorientiertes Fallmanagement und Familiencoach im Quartier","Familiencoachprojekt ""PASSGENAU""  - Verbesserung und Stabilisierung der familiären Verhältnisse um die Grndlagen für eine berufliche Integration zu schaffen",80264.85
ESF/14-SM-B12p-0027/15,109.0,Güstrower Bildungshaus e.V.,18273,04.09.15,31.07.17,Förderung von Integrationsprojekten,"""Integrationsprojekt - LEA  - Lernen Erleben Arbeiten"" - Langzeitarbeitslose junge Frauen und Männer mit komplexen Problemlagen aus dem Altkreis Güstrow sollen durch individuelles Coaching zunächst in ihren persönlichen Verhältnissen stabilisiert und anschließend in das berufliche und gesellschaftliche Leben integriert werden",204962.06
ESF/14-SM-B12p-0021/15,109.0,"Verein ""Perspektive für die Region Bad Doberan"" e.V.",18236,02.09.15,31.08.16,"Stärkung von Familie, insbesondere familienorientiertes Fallmanagement und Familiencoach im Quartier","Familiencoach Region Bad Doberan - Feststellung, Verringerung oder Beseitigung von Vermittlungshemmnissen langzeitarbeitsloser Mütter und Väter mit Kindern mit erheblichen Betreuungsbedarfen, um einen Zugang zum allgemeinen Arbeitsmarkt zu ermöglichen.",81635.83
ESF/14-SM-B12p-0015/16-A01,109.0,Berufsförderungszentrum e. V. Ueckermünde,17373,22.07.16,31.07.17,"Stärkung von Familie, insbesondere familienorientiertes Fallmanagement und Familiencoach im Quartier","Familiencoachprojekt - Ueckermünde + Pasewalk - Es werden HIlfsangebote zur Bewältigung der persönlichen Lebenssituation bzw. zum Abbau der Vermittlungshemmnisse für langzeitarbeitslose Eltern unterbreitet, um die Teilnehmenden so an eine dauerhafte sozialversicherungspflichtige Bechäftigung/Ausbildung heranzuführen.",40251.15
ESF/14-SM-B12p-0002/15-A02,109.0,Rostocker Fraueninitiativen e.V.,18059,04.03.16,15.03.17,Förderung von Integrationsprojekten,Integrationsprojekt - Kontakt für Arbeit - Integrationsarbeit für langzeitarbeitslose Ratsuchende mit schweren psycho-sozialen Hemmnissen in Kooperation mit dem Hanse-Job-Center,126720.32
ESF/14-SM-B12p-0032/15,109.0,Kunstverein KaSo Wismar e.V.,23966,19.01.16,31.08.17,Förderung von Integrationsprojekten,"Integrationsporjekt - Kunsthandwerk zum Abbau von Vermittlungshemmnissen: Abbau von Vermittlungshemmnissen durch handwerkliche Angebote, individuelle Beratung und Betreuung, Begleitung bei Behördengängen, Vermittlung in Ausbildung, Qualifizierung oder den 1. Arbeitsmarkt",185774.55
ESF/14-SM-B12p-0023/16,109.0,TÜV Rheinland Akademie GmbH,17033,01.06.16,31.05.17,Förderung von Integrationsprojekten,Integrationsprojekt - MUT - für die eigene Zukunft - Stabilisierung der persönlichen Lebensverhältnisse; Abbau von Vermittlungshemmnissen; Vermittlung und Erweiterung von berufsfachlichen Sprachkenntnissen durch berufliche Orientierung und Vermittlung von berufspraktischen Grundfertigkeiten; berufliche Neuorientierung und Verbesserung der Eingliederungschancen; stufenweise Integration in den Arbeitsprozess mit dem Ziel einer sozialversicherungspflichtigen Beschäftigung,82566.54
ESF/14-SM-B12p-0013/16,109.0,Fortbildungsakademie der Wirtschaft (FAW) gGmbH,18069,13.05.16,14.04.18,"Stärkung von Familie, insbesondere familienorientiertes Fallmanagement und Familiencoach im Quartier","Familiencoachprojekt  - Familiencoach V - R: Langzeitarbeitslose und ihre Familienmitglieder/Angehörige der Regionen Ribnitz-Damgarten, Barth und Grimmen sollen in Zusammenarbeit mit weiteren Netzwerkpartnern unter Berücksichtigung ihrer Familiensituation wirkungsvoll und nachhaltig für die Aufnahme einer Erwerbstätigkeit aktiviert und gemeinsam eine Grundstabilität insbesondere auch im Alltag geschaffen werden, damit die Existenz dauerhaft durch Arbeit selbst gesichert werden kann.",207459.8
ESF/14-SM-B12p-0018/16,109.0,BMD Bildungszentrum für Marktwirtschaft und Datenverarbeitung GmbH,17235,30.05.16,31.05.17,Förderung von Integrationsprojekten,"Integrationsprojekt ""Karriere-Start"" - Langzeitarbeitslose bzw. von Langzeitarbeitslosigkeit bedrohte Erwachsene ohne abgeschlossene Berufsausbildung bzw. verwertbaren Berufsabschluss sollen in eine berufliche Fortbildung oder in ein nachhaltiges SV-pflichtiges Beschäftigungsverhältnis gebracht werden",61924.85
ESF/14-SM-B12p-0001/15,109.0,"Arbeitslosenverband Deutschland,Kreisverband Müritz e.V.",17207,08.06.15,31.08.16,Förderung von Integrationsprojekten,Integrationsprojekt: Integrierende Arbeitslosen-Service-Einrichtung an der Müritz - Vorbereitung und Vermittlung von Langzeitarbeitslosen mit besonderen Vermittlungshemmnissen in sozialversicherungspflichtige Beschäftigung auf den 1. Arbeitsmarkt,121524.48
ESF/14-SM-B12p-0014/15,109.0,Berufsbildungsstätte START  GmbH,19288,24.07.15,31.10.16,Förderung von Integrationsprojekten,Integrationsprojekt Pharao  - Langzeitarbeitslosen Frauen und Männern mit besonderen Vermittlungshemnissen den Zugang in den allgemeinen Arbeitsmarkt zu ermöglichen und ihre soziale Integfration durch Erwerbstätigkeit zu erreichen,118938.72
ESF/14-SM-B12p-0003/16,109.0,Güstrower Bildungshaus e.V.,18273,17.12.15,31.12.17,"Stärkung von Familie, insbesondere familienorientiertes Fallmanagement und Familiencoach im Quartier","Familiencoachprojekt Sternberg/Crivitz - Mit Familien mit Kindern, insbesondere mit alleinerziehenden Müttern und Vätern, die von Langzeitarbeitslosigkeit und gravierenden Vermittlungshemmnissen betroffen sind, sollen durch verschiedene individuelle vezahnte und praxisorientierte Maßnahmen ein arbeitsmarktbezogenes Familienmanagement durchgeführt werden das zur beruflichen Integration führt.",330265.87
ESF/14-SM-B12p-0007/16,109.0,ISBW - Institut für Sozialforschung und berufliche Weiterbildung gGmbH,17235,19.01.16,28.02.17,"Stärkung von Familie, insbesondere familienorientiertes Fallmanagement und Familiencoach im Quartier","Familiencoachprojekt FAMILIEN AM START - Abbau von Entwicklungs- und Beschäftigungshemmnissen, Verbesserung und Stabilisierung der familiären Situation der Teilnehmer, Vermittlung und Aufbau von Alltags- und Problemlösungskompetenzen",82566.54
ESF/14-SM-B12p-0001/16,109.0,BilSE - Institut für Bildung und Forschung GmbH,18273,08.12.15,31.12.17,"Stärkung von Familie, insbesondere familienorientiertes Fallmanagement und Familiencoach im Quartier","Familiencoachprojekt ""AGiL - Aktiv gemeinsam zurück ins Leben (Hagenow)"" - Feststellung der unterschiedlichen Vermittlungshemmnisse von langzeitarbeitslosen Müttern und Vätern mit dem Ziel durch geeignete Maßnahmen und Methoden diese Vermittlungshemmnisse bedarfsorientiert zu verringern bzw. zu beseitigen und die Integration in sozialversicherungpflichtige Beschäftigung und geringfügige Beschäftigung oder weiterführende Maßnahmen vorzubereiten bzw. durchzuführen",92887.38
ESF/14-SM-B12p-0010/15,109.0,BilSE - Institut für Bildung und Forschung GmbH,18273,05.08.15,31.12.16,Förderung von Integrationsprojekten,Integrationsprojekt - ZENIT GDB - Zielorientierte Integration - Aktivierung; Erhöhung der Beschäftigungsfähigkeit und gesellschaftliche und berufliche Integration von Langzeitarbeitslosen,61226.87
ESF/14-SM-B12p-0010/16,109.0,AFW Arbeitsförderungs- und Fortbildungswerk GmbH,18147,01.03.16,28.02.18,"Stärkung von Familie, insbesondere familienorientiertes Fallmanagement und Familiencoach im Quartier",FC Rostock - FamilienCoach Rostock - Unterstützung und Begleitung der Familie/Bedarfsgemeinschaft der Teilnehmenden zur Verbesserung der persönlichen Situation und Erhöhung der Beschäftigungsfähigkeit. Eine Vermittlung in Arbeit wird angestrebt.,389194.58
ESF/14-SM-B12p-0014/16,109.0,DEKRA Akademie GmbH,17034,30.05.16,31.05.18,Förderung von Integrationsprojekten,"Integrationsprojekt ""CHANCE"" - langzeitarbeitslose, leistungsberechtigte Frauen und Männer mit ausgeprägtem Unterstützungsbedarf sollen in Torgelow in den ersten Arbeitsmarkt integriert werden",228713.66
ESF/14-SM-B12p-0015/15,109.0,BilSE - Institut für Bildung und Forschung GmbH,18273,24.07.15,31.10.16,Förderung von Integrationsprojekten,Integrationsprojekt - AQuA - Arbeit und Qualifizierung für Alleinerziehende - Durch individuelle Begleitung soll langzeitarbeitslosen Alleinerziehenden mit besonderen Vermittlungshemmnissen der Zugang in den allgemeinen Arbeitsmarkt ermöglicht werden und ihre soziale Integration durch Erwerbsarbeit erricht werden,121988.43
ESF/14-SM-B12p-0006/15,109.0,AFW Arbeitsförderungs- und Fortbildungswerk GmbH,18147,25.06.15,29.02.16,Förderung von Integrationsprojekten,Intgrationsprojekt - PHARAO - Offene sozialintegrative Beratungs- und Betreuungsangebote für langzeitarbeitslose Frauen und Männer - Nachhaltige Verbesserung des Zugangs in den allgemeinen Arbeitsmarkt und die sozial-gesellschaftliche und berufliche Intgration durch Erwerbsarbeit der Projektteilnehmenden,80236.28
ESF/14-SM-B12p-0004/15-A01,109.0,"Verein ""Perspektive für die Region Bad Doberan"" e.V.",18236,14.08.15,29.02.16,Förderung von Integrationsprojekten,"Integrationsprojekt - Neustart in den Arbeitsmarkt in Neubukow - Langzeitarbeitslose Frauen und Männer mit besonderen Vermittlungshemmnissen oder Personen mit besonderen arbeitsmarktlichen Problemlagen sollen durch eine individuelle, passgenaue und gezielte Unterstützung und durch die auf die Zielgruppe zugeschnittenen Angebote, eine Erhöhung ihrer Beschäftigungsfähigkeit erreichen und der Zugang in den allgemeinen Arbeitsmarkt ermöglicht werden",40119.97
ESF/14-SM-B12p-0029/15,109.0,Güstrower Bildungshaus e.V.,18273,28.08.15,30.05.16,"Stärkung von Familie, insbesondere familienorientiertes Fallmanagement und Familiencoach im Quartier","""Familiencoach Altkreis Güstrow"" - Die Teilnehmer (insbes. langzeitarbeitslose Alleinerziehende mit multiplen Vermittlungshemmnissen und/oder prekären Einkommensverhältnissen) sollen Schlüsselqualifikationen (wie Belastbarkeit, Kontinuität, Zuverlässigkeit, Teamfähigkeit, Zeitmangement und Selbstwertgefühl) erwerben. Sie sollen so in ihren sozialen und beruflichen Kompetenzen gestärkt werden. Der Familienansatz ermöglicht eine Integration in Arbeit oder Ausbildung sowie die Lebenssituation der Betroffenen signifikant zu verbessern und diesen Zustand dann zu verstetigen.",121988.43
ESF/14-SM-B12p-0020/16,109.0,Güstrower Bildungshaus e.V.,18273,01.06.16,31.05.18,"Stärkung von Familie, insbesondere familienorientiertes Fallmanagement und Familiencoach im Quartier","Familiencoachprojekt in Güstrow; Teterow/Gnoien; Bützow - Mit dem Projekt werden alle erwerbslosen Mitglieder einer Bedarfsgemeinschaft bei der Integration in Arbeit u/o Ausbildung unterstützt durch die Entwicklung einer beruflichen, lebensorientierten Perspektive für Eltern und Kinder.",332674.4
ESF/14-SM-B12p-0005/16,109.0,ibu  institut für berufsbildung und umschulung gmbh,19306,18.12.15,30.06.17,Förderung von Integrationsprojekten,"Integrationsprojekt - Mittendrin LUP - Reintegration von älteren Langzeitarbeitslosen in den Arbeitsmarkt mittels Erschließung, Reaktivierung oder Ergänzung qualifikatorischer Potentiale und Abbau von Vermittlungshemmnissen. Förderung und Erhöhung der Beschäftigungsfähigkeit der Teilnehmer.",185774.71
ESF/14-SM-B12p-0011/15,109.0,TÜV Rheinland Akademie GmbH,17033,10.09.15,30.06.16,Förderung von Integrationsprojekten,"""Plan B - Brücken schlagen, Neues wagen"" - Förderung und Unterstützung der Teilnehmer bei der Wiederherstellung der psychischen Gesundheit als Voraussetzung für eine erstmalige oder erneute berufliche Integration. Berufliche Neuorientierung und Verbesserung der Eingliederungschancen der Teilnehmer aus dem Rechtskreis SGB II in den Arbeitsmarkt sowie stufenweise Integration in den Arbeitsprozess.",97404.65
ESF/14-SM-B12r-0001/15,109.0,Kunstverein KaSo Wismar e.V.,23966,06.05.15,29.02.16,Förderung von Integrationsprojekten,"Kunsthandwerk zum Abbau von Vermittlungshemmnissen - mit Hilfe von kunsthandwerklichen Tätigkeiten sollen multiple Vermittlungshemmnisse abgebaut werden und somit der Zugang in Arbeit, Ausbildung oder weiterführende Maßnahmen geschaffen werden",119176.03
ESF/14-SM-B12r-0007/15,109.0,Ev.-Luth. Kirche in Norddeutschland c/o Ev.-Luth. Kirchgemeinde Bad Doberan,18209,07.09.15,29.02.16,Förderung von Integrationsprojekten,"""Treffpunkt Suppenküche"" - Verringerung der Vermittlungshemmnisse von Langzeitarbeitslosen und Flüchtlingen durch Teilhabe in bürgerschaftlichem Engagement",59311.78
ESF/14-SM-B12r-0006/16,109.0,Grone-Bildungszentren Mecklenburg-Vorpommern GmbH - gemeinnützig - Bildungszentrum Stralsund,18437,04.05.16,30.11.16,Förderung von Integrationsprojekten,- Integrationsprojekt neuSTART PLUS - Verbesserung der Integrationschancen von Langzeitarbeitslosen sowie ihre Integration in Ausbildung oder Arbeit durch die Entwicklung und Erprobung eines partizipativen Messinstruments zur Erfassung der individuellen Beschäftigungsfähigkeit von langzeitarbeitslosen Menschen in Kooperation mit dem Institut für Sportwissenschaft der Universität Rostock und der ISBW gGmbH,81123.45
ESF/14-SM-B12r-0002/16-A01,109.0,"Universität Rostock, Institut für Sportwissenschaft",18057,10.05.16,31.12.16,Förderung von Integrationsprojekten,neuSTART PLUS II - Entwicklung und Erprobung eines partizipativen Messinstruments zur Erfassung der individuellen Beschäftigungsfähigkeit von langzeitarbeitslosen Menschen in Kooperation mit dem ISBW gGmbH,190910.27
ESF/14-SM-B12r-0005/15,109.0,Blinden- und Sehbehinderten- Verein M-V e.V.,18106,05.08.15,29.02.16,Förderung von Integrationsprojekten,"Inklusionsprojekt VisionA - Durch eine ganzheitliche Beratung, Unterstützung und Maßnahmen soll der Zugang zum Arbeitsmarkt für Sehbehinderte und Blinde erleichtert bzw. ermöglicht werden",79651.65
ESF/14-SM-B12r-0009/16,109.0,BilSE - Institut für Bildung und Forschung GmbH,18273,13.06.16,30.06.18,Förderung von Integrationsprojekten,JobVital 35+  - Modellhafte Erprobung der Integration langzeitarbeitsloser oder von Langzeitarbeitslosigkeit bedrohter Menschen über 35 Jahre mit präventiven gesundheitsfördernden Bedarfen in Arbeit durch die Verzahnung der Integrationsförderung und dem Abbau gesundheitlicher Defizite durch eine präventive Gesundheitsorientierung in Zsammenarbeit mit der Gesetzlichen Krankenversicherung  in Teterow und Güstrow,264398.99
ESF/14-SM-B12r-0004/15,109.0,Wohltat e. V.,18146,10.07.15,28.02.17,Förderung von Integrationsprojekten,Integrationsprojekt - Integrative Arbeit und Angebote sozialer Teilhabe für Langzeitarbeitslose in der Hansestadt Rostock - Mit dem Projekt soll durch die messbare und nachhaltige Verbesserung der sozialen Integration die Grundlagen für eine berufliche Integration geschaffen werden,60737.77
ESF/14-SM-B12r-0008/16,109.0,Arbeitslosenverband Deutschland Landesverband M-V e.V.,18246,17.06.16,28.02.17,Förderung von Integrationsprojekten,Integrationsprojekt - Mobilisierung und Koordinierung regionalen/lokalen Sozialkapitals zur Förderung von Beschäftigungsfähigkeit und Gesundheit langzeitarbeitsloser Frauen und Männer und deren Familien,100798.65
ESF/14-SM-B12r-0006/15,109.0,"Arbeitslosenverband Deutschland, Landesverband M-V e.V.",19063,05.08.15,29.02.16,Förderung von Integrationsprojekten,Integrationsprojekt - Aktivierung und Koordinierung regionaler und lokaler Potenziale des Arbeitslosenverbandes,100776.42
ESF/14-SM-B12r-0008/15,109.0,BilSE - Institut für Bildung und Forschung GmbH,18273,07.09.15,31.08.16,Förderung von Integrationsprojekten,Integrationsprojekt - SLALOM - Praktische Starthilfen für langzeitarbeitslose und von Langzeitarbeitslosigkeit bedrohte Menschen,405811.61
ESF/14-SM-B12r-0005/16,109.0,Blinden- und Sehbehinderten- Verein M-V e.V.,18106,06.05.16,28.02.18,Förderung von Integrationsprojekten,"Integrationsrojekt ""visionA"" - Begleitung und Unterstützung sehbehinderter und blinder Menschen in Beruf und Gesellschaft",164283.73
ESF/14-SM-B12r-0001/16,109.0,ISBW - Institut für Sozialforschung und berufliche Weiterbildung gGmbH,17235,17.12.15,31.12.16,Förderung von Integrationsprojekten,neuSTART PLUS II - Entwicklung und Erprobung eines partizipativen Messinstruments zur Erfassung der individuellen Beschäftigungsfähigkeit von langzeitarbeitslosen Menschen in Kooperation mit Institut für Sportwissenschaft der Universität Rostock,114599.07
ESF/14-SM-B12r-0003/15,109.0,Kreissportbund Vorpommern-Greifswald e. V.,17389,18.06.15,29.02.16,Förderung von Integrationsprojekten,"Integrationsprojekt ""BIGGER"" - Bewegung als Investition in Gesundheit - Gemeinsam erleben - Förderung und Stärkung der Gesundheit der Teilnehmenden um sie für den Arbeitsmarkt fit zu machen",41326.2
ESF/14-SM-B12r-0002/15,109.0,Fußballverband Vorpommern e.V.,17491,09.06.15,28.02.16,Förderung von Integrationsprojekten,"Integrationsprojekt ""Sportlich Miteinander"" - Durch Sportangebote sollen Langzeitarbeitslose gesellschaftlich integriert werden und ihre Gesundheit verbessern um somit eine Grundlage für eine berufliche Integration zu schaffen",83749.03
ESF/14-SM-B13-0041/16,109.0,BQG Bützow und Umland e.V.,18246,30.06.16,30.06.17,Förderung von Kleinprojekten,Schaffung einer Begegnungsstätte in Viezen - durch die gemeinsame Gestaltung eines Treffpunktes im Agrarmuseum Viezen sollen sozial Benachteiligte in das gesellschaftliche Leben der Gemeinde Bernitt integriert werden,8200.0
ESF/14-SM-B13-0045/15,109.0,ÜAZ Überregionales Ausbildungszentrum Waren/Grevesmühlen e.V.,17192,24.11.15,30.11.16,Förderung von Kleinprojekten,"Willkommen an der Müritz 'Zeitung für Alle in leichter Sprache' - ein Projekt  zur Integration von Migranten/Flüchtlingen und zur Förderung der Teilhabe am gesellschaftlichen, politischen und kulturellen Leben der Migranten und Flüchtlinge sowie von Menschen mit eingeschränkten Lesekompetenzen bzw. Textverständnis",8200.0
ESF/14-SM-B13-0023/15,109.0,Sozialverband VdK Mecklenburg - Vorpommern e. V. Ortsverband Stralsund,18437,31.07.15,14.12.15,Förderung von Kleinprojekten,Gemeinsam sind wir stark - Langzeitarbeitslosen Frauen und Männern sollen Fähigkeiten an modernen Kommunikationsmitteln vermittelt werden um sie sozial zu integrieren und somit Grundlagen für eine berufliche Integration zu schaffen,5000.0
ESF/14-SM-B13-0008/15,109.0,Familiensozialprojekt Vorpommern e.V.,18507,04.08.15,30.06.16,Förderung von Kleinprojekten,Gesund leben - Gesunde Ernährung für langzeitarbeitslose Frauen und Männer sowie deren Familien um Grundlagen für eine gesellschaftliche und berufliche Integration zu schaffen,8200.0
ESF/14-SM-B13-0006/16,109.0,Verein Neues Landleben Bresch e. V. / Ortsgruppe Ziegendorfer Landfrauen,19372,17.12.15,31.12.16,Förderung von Kleinprojekten,"Treffpunkt altes Pfarrhaus - gemeinsam statt einsam: generationsübergreifendes Projekt zur Schaffung einer Räumlichkeit für soziale Arbeit zur sozialen Teilhabe von Langzeitarbeitslosen, Arbeitslosen, Senioren, Kinder und Jugendlichen",8200.0
ESF/14-SM-B13-0015/16,109.0,Tollensewinkel (Vorpommern) e.V.,17091,17.12.15,31.12.16,Förderung von Kleinprojekten,Interaktives und integratives Vereinshaus in Wildberg - es soll ein Ort des Austausches sowie der sozialen Intgration entstehen. Hier sollen neue Angebote durch die vorhandenen Vereine und Verbände für Einheimische und Flüchtlinge etabliert werden,8200.0
ESF/14-SM-B13-0034/16,109.0,Kirchengemeinde Grünow / Triepkendorf,17237,30.05.16,31.05.17,Förderung von Kleinprojekten,"Archivkirche Goldenbaum - Das Eigene im Fremden - Durch gemeinsame Erlebnisse, Erfahrungen und den Austausch bzw. die Dokumentation zur eigenen Geschichte soll ein qualitatives Wir-Gefühl erzeugt werden. Eine solche Aufarbeitung soll Kontakt, Kommunikation und Engagment in der Gemeinde und Umgebung schaffen.",8200.0
ESF/14-SM-B13-0012/15,109.0,Kulturnetzwerk Mecklenburg - Vorpommern e.V.,18057,03.09.15,31.08.15,Förderung von Kleinprojekten,Generationsübergreifende Medienqualifizierung von Migrantinnen und Migranten beim Bürgerradio LOHRO - durch die Vermittlung von Medien- und Radiokompetenzen sowie von kommunikativen und sozialen Kompetenzen sollen den Teilnehmenden der Einstieg in die zivilgesellschaftlichen Strukturen Rostocks und die Chancen auf dem Arbeitsmarkt erhöht werden,5000.0
ESF/14-SM-B13-0006/15,109.0,Pommerscher Diakonieverein e.V.,17489,04.08.15,30.06.16,Förderung von Kleinprojekten,BEGREIFMICH - Schaffung von Begegnungsräumen für Menschen aus vielen Ländern mit der heimischen Bevölkerung mit dem Ziel der gesellschaftlichen Integration als Grundlage für eine berufliche Integration,8200.0
ESF/14-SM-B13-0010/15,109.0,Verein der Kinder- und Jugendförderung Burgsee e.V.,19205,04.08.15,31.12.15,Förderung von Kleinprojekten,"DRACHENMÄDCHEN - Entwicklung von Kompetenzen im Umgang mit Medien und der Wirkung von Medien durch die Erstellung eines Storybords für eine fiktive Geschichte und eines Dokumentarfilmes über das Projekt, die in der Öffentlichkeit eingesetzt werden können. Die Teilnehmenden sollen sich dadurch Grundlagen für die gesellschafliche und berufliche Intgration schaffen.",5000.0
ESF/14-SM-B13-0010/16,109.0,Kunstverein Teterow e.V.,17166,17.12.15,31.12.16,Förderung von Kleinprojekten,Kunst verbindet - ein Projekt zur gesellschaftlichen und sozialen Integration von Flüchtlingen und Menschen mit physischen und psychischen Beeinträchtigungen in das gesellschaftliche Alltagsleben durch das praktische Heranführen an die klassischen Künste,8200.0
ESF/14-SM-B13-0002/15,109.0,Internationales Kahnschifferzentrum STETTINER HAFF e.V.,17367,21.07.15,31.10.15,Förderung von Kleinprojekten,"Bau von Krippen als Sitzgelegenheiten - Durch das Projekt soll ein Angebot für Langzeitarbeitslose und andere geschaffen werden, um den sozialen Zusammenhalt durch praktische Arbeit zu stärken. Bei den Langzeitarbeitslosen soll damit ihre Beschäftigungsfähigkeit erhöht werden.",5000.0
ESF/14-SM-B13-0019/16,109.0,Landesverband evangelischer Gemeinschaften Vorpommern e. V. Evangelische Gemeinschaft Demmin,17109,17.12.15,31.12.16,Förderung von Kleinprojekten,"Miteinander lernen - Asylsuchende und Deutsche - Vermittlung deutscher Sprachkenntnisse zur Bewältigung des täglichen Lebens an Asylsuchenden von ehrenamtlich tätigen Bürgern aus der Region Demmin durch gemeinsames Lernen, Arbeiten, Kochen und anderer Tätigkeiten",8200.0
ESF/14-SM-B13-0034/15,109.0,"Arbeitslosenverband Deutschland, Ortsverein Gadebusch e.V.",19205,26.08.15,31.08.16,Förderung von Kleinprojekten,"Ziel ist es, die soziale Isolation von Langzeitarbeitslosen bzw. Langzeitleistungsbeziehenden zu durchbrechen, Wissen über verantwortungsvolles sowie sparsames, nachhaltiges Konsumverhalten zu vermitteln, Fähigkeiten zur Befriedigung des eigenen bzw. familiären Kleidungsbedarfes zu schaffen sowie positive Selbstwirksamkeitserfahrungen zu ermöglichen",8200.0
ESF/14-SM-B13-0021/16,109.0,Amt Demmin Land - Gemeinde Kletzin,17109,17.12.15,31.12.16,Förderung von Kleinprojekten,Kletzin - gelebte Integration und sozialer Zusammenhalt aller Bürger der Gemeinde - Durch gemeinsame Aktionen zum Austausch der verschiedenen Lebensweisen und Kulturen soll das gegenseitige Verständnis und die Integration der neuen Mitbürger von Einwohnern und Asylbewerbern erfolgen.,8200.0
ESF/14-SM-B13-0023/16,109.0,Gemeinde Siedenbollentin im Amt Treptower Tollensewinkel,17087,19.01.16,31.01.17,Förderung von Kleinprojekten,"Einwohner der Gemeinde stellen ihre Heimat vor - eine Bilderausstellung gibt Auskunft: ein Projekt zur Stärkung des gesellschaftlichen Engagements und der Verbundenheit zur Region. Die Teilnehmenden aus allen Generationen Siedenbollentins bilden unterschiedliche Interessengruppen und fotografieren und zeichnen Persönlichkeiten, Unternehmen, Veranstaltungen und die nähere Umgebung. Das Ergebnis werden unterschiedliche Ausstellungen in unterschiedlichen Räumen sein um so die Verbundenheit mit der Gemeinde zum Ausdruck zu bringen und zum Meinungsaustausch anzuregen.",8200.0
ESF/14-SM-B13-0042/16,109.0,ibu  institut für berufsbildung und umschulung gmbh,19306,15.08.16,28.02.17,Förderung von Kleinprojekten,Ein guter Holzweg - ein Projekt zur Integration von Kindern und Jugendlichen mit und ohne Migrationshintergrund aus Neustadt-Glewe und Umgebung durch das gemeinsame Kennenlernen der Holzverarbeitung und Herstellung von Kleinmöbeln,5000.0
ESF/14-SM-B13-0032/16,109.0,"Verein ""Hilfe zur Erziehung"" e. V.",17358,30.05.16,30.11.16,Förderung von Kleinprojekten,Gemeinsam planen und gestalten wir einen Familiengarten - im Familienzentrum Torgelow,5000.0
