Name des Begünstigten,Bezeichnung des Vorhabens,Jahr der Bewilligung / Jahr der Restzahlung,Gewährte Beträge - ERDF und Nationale Mittel ohne Eigenmittel,Bei Abschluss des Vorhabens gezahlte Gesamtbeträge
"Abwasserverband Bickenbach, Seeheim-Jugenheim","Förderung des Demonstrationsvorhabens ""Mikrogasturbine in der Verbandskläranlage Bickenbach""",2012,,"155.100,00"
"Abwasserverband Main-Taunus, Hofheim","Förderung des Demonstrationsvorhabens ""Mikrogasturbine und BHKW im Klärwerk Kriftel""",2013,,"206.800,00"
"Abwasserverband ""Obere Dietzhölze"", Eschenburg","Förderung des Demonstrationsvorhabens ""Klärgas betriebene Mikrogasturbine in der Kläranlage Eibelshausen""",2014,,"127.400,00"
"ACTI-MED AG, Freiensteinau",Erweiterung einer Betriebsstätte in 36399 Freiensteinau,2013,,"328.733,08"
"Agnieszka Sliwinska, Korbach","Pilot- und Demonstrationsvorhaben ""Brennstoffzelle Viessmann Vitovalor 300-P im Wohnhaus""",2015,,"12.999,85"
"Air-Eltec Luftfahrtelektrik GmbH, Herborn",Erweiterung einer Betriebsstätte in 35745 Herborn,2011,,"637.600,00"
"Albert Koch GmbH Maschinen- und Vorrichtungsbau, Baunatal","Cluster ""DieMaschinenbauPartner"": Initiierungsphase",2008,,"25.000,00"
"Albert Koch GmbH Maschinen- und Vorrichtungsbau, Baunatal","Cluster ""DieMaschinenbauPartner"" Aufbauphase 2010 - 2013",2010,,"217.551,57"
"Albert Koch GmbH Maschinen- und Vorrichtungsbau, Baunatal","Cluster ""DieMaschinenbauPartner"" - Verstetigungsphase, 08-2013 bis 12-2015",2013,,"229.661,60"
"Aleit GmbH, Steffenberg",Einstellung eines/r Innovationsassistenten/in in 35239 Steffenberg,2010,,"28.700,00"
"Alexander Schön, Steinbach","Pilot- und Demonstrationsvorhaben ""Mikro-BHKW-Brennstoffzelle Viessmann Vitovalor 300- P""",2015,,"13.345,85"
"ANALYTICON Biotechnologies AG, Lichtenfels OT Dalwigksthal",Einstellung eines/r Innovationsassistenten/in in 35104 Lichtenfels-Dalwigksthal,2009,,"29.200,00"
"ANALYTICON Biotechnologies AG, Lichtenfels OT Dalwigksthal",Einstellung einer Innovationsassistentin in 35104 Lichtenfels,2012,,"26.000,00"
"Angewandte Kunst Hessen e.V., Kassel",Tendence Decorate Life,2008,,"2.688,00"
"Anlagenbau Günther GmbH, Wartenberg",Einstellung eines Innovationsassistenten in 36367 Wartenberg,2013,,"28.000,00"
"Arbeitsgemeinschaft der Hessischen Handwerkskammern, Wiesbaden",Sonderberatungsstellen der hessischen Handwerkskammern 2011-2013,2011,,"1.486.200,00"
"Arbeitsgemeinschaft der Hessischen Handwerkskammern, Wiesbaden",Sonderberatungsstellen der hessischen Handwerkskammern 2014,2014,,"495.400,00"
"Arbeitsgemeinschaft der Hessischen Handwerkskammern, Wiesbaden",Sonderberatungsstellen der hessischen Handwerkskammern 2015,2015,,"448.043,31"
"Arbeitsgemeinschaft hess. Industrie- und Handelskammern; IHK Frankfurt am Main, Frankfurt am Main",Fünf Regionale Beratungsstellen im TTN-Hessen 2013/2014,2013,,"393.661,27"
"Arbeitskreis Grenzinformation e.V., Bad Sooden-Allendorf","Grenzmuseum Schifflersgrund, Neugestaltung einer Aussstellungs- halle",2011,,"159.100,00"
"Arbeitskreis Grenzinformation e.V., Bad Sooden-Allendorf",Optimierung der Innenausstattung der Veranstaltungshalle in der Gedenkstätte Grenzmuseum Schifflersgrund,2013,,"24.750,00"
"Art Directors Club für Deutschland e. V., Berlin",Junior Days 2010,2009,,"200.000,00"
"Art Directors Club für Deutschland e. V., Berlin",Junior Days 2011,2011,,"200.000,00"
"Art Directors Club für Deutschland e. V., Berlin",Juinior Days 2012,2011,,"200.000,00"
"Ausbildungsverbund Rhöner Lebensmittel e.V., Hilders",Ergänzung der Küchenausstattung für das Ausbildungszentrum Handwerkerhof Hilders,2012,,"5.300,00"
"awamo GmbH, Frankfurt am Main",awamo - Vorbereitung Beta-Phase Uganda,2015,,"25.000,00"
"Bähr Filmtheaterbetriebe e. K. Friedrich Bähr, Diemelsee","Umrüstung einer Leinwand von analoger auf digitale Projektionst echnik, Kino Willingen, Studio 1",2011,,"19.284,38"
"Bähr Filmtheaterbetriebe e. K. Friedrich Bähr, Diemelsee","Umrüstung einer Leinwand von analoger auf digitale Projektionste chnik, Kino-Willingen, Studio Kino 3",2011,,"20.387,84"
"Bähr Filmtheaterbetriebe e. K. Friedrich Bähr, Diemelsee",Umrüstung eines Kinosaales der Kurlichtspiele Bad Wildungen von analoger auf digitale Projektionstechnik,2014,,"11.410,63"
"Bali Kinos im Kasseler Hauptbahnhof GmbH, Kassel","Umrüstung einer Leinwand von analoger auf digitale Projektionste chnik, Gloria Kino, Friedrich Ebert Straße 3, 34119 Kassel",2011,,"20.371,00"
"Bali Kinos im Kasseler Hauptbahnhof GmbH, Kassel","Umrüstung von 2 Leinwänden von analoger auf digitale Projektions technik, gr. und kl. Bali Kino, Rainer Dierichs Platz 1, Kassel",2011,,"38.306,54"
"BAND Business Angels Netzwerk Deutschland e. V., Essen",Deutscher Business Angels Tag 2012,2012,,"45.405,73"
"Barbizz-Netzwerk für Unternehmer und Beweger im Wirtschaftsraum Hanau vertreten durch m2 agentur für kommunikation GmbH, Hanau",Barbizz-Netzwerk für Unternehmer und Beweger im Wirtschaftsraum Hanau,2013,,"37.047,57"
"Barbizz-Netzwerk für Unternehmer und Beweger im Wirtschaftsraum Hanau vertreten durch m2 agentur für kommunikation GmbH, Hanau",Barbizz - Netzwerk für Unternehmer und Beweger im Wirtschaftsraum Hanau - Fortführung Januar bis Dezember 2015,2015,,"25.047,10"
"Bauhandwerks-Innung für den Kreis Hersfeld-Rotenburg, Bebra",Inventarerneuerung eines Unterrichtsraumes in der Lehrbaustelle Bebra,2014,,"16.733,11"
"Bauhandwerks-Innung Limburg-Weilburg, Limburg",Neubeschaffung eines Radladers für das Ausbildungszentrum der Bauhandwerks-Innung Limburg-Weilburg,2011,,"25.287,00"
"Bauhandwerks-Innung Limburg-Weilburg, Limburg",Beschaffung v. IT- und EDV-Ausstattung für d. Ausbildungszentrum der Bauhandwerks- Innung Limburg-Weilburg,2013,,"7.747,49"
"Bau-Innung Werra-Meißner, Eschwege",Modernisierung der Ausstattung im Ausbildungszentrum der Bauwirtschaft für den Werra- Meißner-Kreis in Eschwege,2014,,"212.404,16"
"BBK Kassel-Nordhessen e. V., Kassel",Kunstmesse Kassel 2014,2014,,"23.887,81"
"BDP Bildungsstätte Vogtscher Hof e. V., Felsberg",Erneuerung der Außentreppe der Bildungsstätte Vogtscher Hof in Felsberg-Gensungen,2014,,"8.625,04"
"Behle Hochheide GmbH & Co. KG, Willingen (Upland)",Erweiterung einer Betriebsstätte in 34508 Willingen,2013,,"180.000,00"
"Berggasthof Ahrenberg GmbH & Co. KG, Bad Sooden-Allendorf",Erweiterung einer Betriebsstätte in 37242 Bad Sooden-Allendorf,2011,,"479.388,32"
"Bernd Manthei Zerspanungstechnik GmbH & Co. KG, Dautphetal",Erweiterung einer Betriebsstätte in 35232 Dautphetal,2011,,"1.083.600,00"
"Berufsbildungswerk des Hessischen Dachdeckerhandwerks e. V., Weilburg",Modernisierungs- und Umstrukturierungsmaßnahmen im Dachdecker-Zentrum Hessen in Weilburg,2010,,"430.700,00"
"Berufsbildungswerk Südhessen gGmbH, Karben",Ergänzung der Ausstattung an den verschiedenen Standorten des BBW Südhessen gGmbH,2009,,"74.000,00"
"Berufsbildungswerk Südhessen gGmbH, Karben","Bauliche Modernisierung der Gebäudeteile 2.0, 3.0 und 5.0 des BBW Südhessen in Karben",2012,,"800.000,00"
"Berufsbildungswerk Südhessen gGmbH, Karben",Beschaffung von Ausstattung für den neuen Ausbildungsberuf Fachinformatiker/in Systemintegration im BBW Südhessen in Karben,2015,,"35.655,64"
"Bildungs- und Technologiezentrum für Elektro- und Informationstechnik e.V., Lauterbach",Entwicklung des BZL in Lauterbach zu einem Kompetenzzentrum für Prozessautomation in Klein- und Mittelbetrieben,2011,,"184.800,00"
"Bildungs- und Technologiezentrum für Elektro- und Informationstechnik e.V., Lauterbach",Modernisierung der Ausstattung im Bildungs- und Technologiezentrum für Elektro- und Informationstechnik e.V.,2011,,"99.328,95"
"Bildungs- und Technologiezentrum für Elektro- und Informationstechnik e.V., Lauterbach",Neubau eines Internats für das BZL Lauterbach,2012,"1.045.278,00",
"Bildungswerk BAU Hessen-Thüringen e.V., Erfurt","Modernisierung des EBL Bildungszentrums Frankfurt am Main, erster und zweiter Bauabschnitt",2008,,"5.897.700,00"
"Bildungszentrum des Hessischen Handels gGmbH, Frankfurt am Main",Beauftragter für Innovation und Technologietransfer im Handel (BIT),2008,,"96.350,00"
"Bioenergiedorf Heubach eG, Kalbach","Demonstrationsvorhaben ""Holzvergaseranlage in Heubach""",2014,,"145.750,00"
"BioNatur GbR Iris & Dirk Rateike, Gilserberg","Errichtung einer Betriebsstätte in 34630 Gilserberg, Bahnhofstraße 57",2008,,"178.510,64"
"Breitband Marburg-Biedenkopf GmbH, Marburg",Machbarkeitsstudie zur Vorbereitung von Breitbandinfrastruktur maßnahmen für ein regionales Hochleistungsnetz (NGA),2011,,"38.300,00"
"Brenergo GmbH, Erbach",CLEO - Cluster Erneuerbare Energien Odenwald Aufbauphase - 2009 - 2011,2009,,"238.555,28"
"BTQ Kassel Beratungsstelle für Technologiefolgen u. Qualifizierung im ver.di Bildungswerk im Lande Hessen e. V., Kassel",Neue Technologien und Wettbewerbsfähigkeit 2008/2009,2008,,"166.836,07"
"BTQ Kassel Beratungsstelle für Technologiefolgen u. Qualifizierung im ver.di Bildungswerk im Lande Hessen e. V., Kassel",Neue Technologien und Wettbewerbsfähigkeit 2010,2010,"99.016,42",
"BTQ Kassel Beratungsstelle für Technologiefolgen u. Qualifizierung im ver.di Bildungswerk im Lande Hessen e. V., Kassel",Neue Technologien und Wettbewerbsfähigkeit 2011,2011,,"83.864,99"
"BTQ Kassel Beratungsstelle für Technologiefolgen u. Qualifizierung im ver.di Bildungswerk im Lande Hessen e. V., Kassel",Wissenslogistik in KMU 2012/2013,2012,,"149.016,76"
"Buchbinderei Thomas Zinn, Kleinlüder",Übernahme einer von der Stilllegung bedrohten Betriebsstätte mit Erweiterung in 36137 Kleinlüder,2009,,"110.683,58"
"Burghof M & H Betriebs-GmbH Meisinger & Hinz GbR, Brombachtal","Errichtung einer Betriebsstätte in 64753 Brombachtal, Burghof 16",2010,,"549.700,00"
"Burgtheater Peter Unger, Schwalmstadt","Umrüstung einer Leinwand von analoger auf digitale Projektionste chnik des Burgtheaters, Schwalmstadt",2013,,"13.097,99"
"Butzbacher Filmtheater Betriebsgesellschaft mbH, Butzbach","Umrüstung einer Leinwand von analoger auf digitale Projektionste chnik, Butzbacher Filmtheater, Rossbrunnenstrasse 3, Butzbach",2011,,"20.250,00"
"Butzbacher Filmtheater Betriebsgesellschaft mbH, Butzbach",Umrüstung des Open-Air-Kinos im Landgrafenschloss (1Leinwand) von analoger auf digitale Projektionstechnik in 2k/4K-Qualität,2011,,"21.000,00"
"BZ Bildungszentrum Kassel GmbH, Kassel",Technologietransfer im Handwerk,2008,,"5.500,00"
"BZ Bildungszentrum Kassel GmbH, Kassel",Modernisierung der Ausstattung in den Bildungszentren der BZ Bildungszentrum Kassel GmbH,2010,,"622.397,30"
"BZH Bildungszentrum Handel und Dienstleistungen gGmbH, Marburg",Technologietransfer im Handel,2008,,"5.000,00"
"BZH Bildungszentrum Handel und Dienstleistungen gGmbH, Marburg","""Beauftragter für Innovation und Technologie - BIT"" im Handel",2009,,"9.569,48"
"cassel creative competence e.V., Kassel",Weiterentwicklung und Ausbau der Marken- und Netzwerkbildung,2008,,"22.900,00"
"Cesah GmbH, Darmstadt",Innovation und Strukturentwicklung basierend auf GALILEO Anwendungen - Fortsetzung,2008,,"21.420,00"
"Christa und Ludwig Böhmer, Büttelborn","Pilot- und Demonstrationsvorhaben ""Brennstoffzelle Viessmann Vitovalor 300-P im Wohnhaus""",2015,,"16.384,00"
"Christine und Michael Schmidt, Bad Arolsen","Pilot- und Demonstrationsvorhaben ""Mikro-KWK-Brennstoffzelle Viessmann Vitovalor 300-P im Wohnhaus""",2015,,"17.532,00"
"Christoph Pappert GmbH & Co. KG (BsG) Pappert Hydrocut GmbH & Co. KG (BtG), Dipperz",Verlagerung / Erweiterung einer Betriebsstätte in 36160 Dipperz,2011,,"309.900,00"
"Cineplex  Marburg GmbH & Co Filmtheater KG, Marburg","Umrüstung von 2 Leinwänden von analoger auf digitale Projektions technik, Capitol Center, 1. Capitol, 2. Cinema, Biegenstr. 8, M.",2011,,"32.816,00"
"Cluster CI3 vertreten durch CI3 Managment UG, Mainz",Cluster CI3 -  Aufbauphase 2013 - 2015,2013,,"200.527,89"
"Cluster CLEO, vertreten durch Energiegenossenschaft Odenwald e.G., Michelstadt",CLEO - Cluster Erneuerbare Energien Odenwald - Verstetigungsphase 2012 - 2014,2012,,"256.172,17"
"Cluster Comptence Center Aerospace (CCA) vertreten durch Wirtschaftsförderung Region Kassel GmbH, Kassel",Cluster- Competence Center Aerospace (CCA) / Aufbauphase 2011 - 2014,2011,,"200.987,93"
"Cluster ""IT FOR WORK"" vertreten durch IHK Darmstadt Service GmbH, Darmstadt","IT FOR WORK - Verstetigungsphase, 2012 - 15",2012,,"340.547,61"
"Cluster Logistik RheinMain, Die Wissensinitiative, vertreten durch House of Logistics & Mobility (HOLM) GmbH, Frankfurt",Cluster Logistik RheinMain - Verstetigungsphase,2011,,"318.571,55"
"Cluster MobilitätRheinMain vertreten durch House of Logsitics and Mobility GmbH, Frankfurt",Cluster MobilitätRheinMain - Aufbauphase 2013 - 2015,2013,,"309.985,15"
"CONPOWER Technik GmbH & Co. KG, Kaufungen",Einstellung eines Innovationsassistenten in 34260 Kaufungen,2011,,"27.400,00"
"Cornelia und Jean-Marc Vogt, Kelkheim","Pilot- und Demonstrationsvorhaben ""Brennstoffzelle Viessmann Vitovalor 300-P im Einfamilienwohnhaus""",2014,,"19.264,00"
"CreAppTec GmbH, Kronberg im Taunus",VibyGo,2015,,"25.000,00"
"DATAWERK GmbH & Co. KG, Kassel",Einstellung eines Innovationsassistenten in 34117 Kassel,2013,,"28.000,00"
"deeliva UG (haftungsbeschränkt), Frankfurt",Marktplatz für Sofortlieferungen,2015,,"25.000,00"
"Der Kreisausschuss des Landkreises Fulda, Fulda",Erstellung eines touristischen Entwicklungsgutachtens mit Masterplan für das Gebiet der Wasserkuppe,2008,,"85.100,00"
"Der Wert J-Werteverwaltungs- GmbH, Starnberg","Umrüstung einer Leinwand von analoger auf digitale Projektionste chnik, Autokino Gravenbruch, 63263 Neu-Isenburg",2011,,"17.500,00"
"Deula gGmbH, Witzenhausen",Modernisierung der Bodenhalle in der DEULA Witzenhausen gGmbH,2011,,"380.480,41"
"Deula gGmbH, Witzenhausen",Modernisierung der Schulungshallen und Werkstätten in der DEULA Witzenhausen gGmbH,2014,,"562.773,89"
"Deutsche Zukunfts-Akademie e.V., Wöllstadt","Kongress ""Regionales Zukunftsmanagement""",2012,,"11.580,00"
"Deutscher Designer Club e. V., Frankfurt am Main",25 Jahre DDC: Ziele des Jubiläums - 25 Jahre,2014,,"44.018,87"
"Deutsches Filminstitut - DIF e.V., Frankfurt am Main","Umrüstung einer Leinwand von analoger auf digitale Projektionste chnik, Deutsches Filmmuseum, Schaumainkai 41, Frankfurt",2011,,"19.500,00"
"Die Filminsel - Kommunales Kino Biblis e.V., Biblis","Umrüstung einer Leinwand von analoger auf digitale Projektionste chnik, Filminsel Biblis, Saal 1, Hintergasse 3, Biblis",2011,,"20.938,00"
"Dieter Liphardt GmbH & Co.KG, Großalmerode","Demonstrationsvorhaben ""Abwärmenutzung durch eine ORC-Anlage mit 2 Modulen in der Feuerfestindustrie""",2015,,"134.900,00"
"Dietz Automation GmbH, Neukirchen-Riebelsdorf",Errichtung einer Betriebsstätte in 34537 Bad Wildungen,2009,,"361.700,00"
"digitop media GmbH, Fulda",Einstellung eines/r Innovationsassistenten/in in 36037 Fulda,2007,,"26.100,00"
"Dr. Ing. Ulrich Esterer GmbH & Co. KG, Helsa",Grundlegende Änderung des Gesamtproduktionsverfahrens einer bestehenden Betriebsstätte,2008,,"626.397,20"
"Dr. Norbert Haspel, Lorsch","Pilot- und Demonstrationsvorhaben ""Brennstoffzellenheizgerät Ceramic Fuel Cells, BlueGEN""",2015,,"15.288,00"
"DVS Innovation GmbH, Eschwege","Errichtung einer Betriebsstätte in 37269 Eschwege, Hessenring 4",2008,,"482.345,18"
"EBS Universität für Wirtschaft und Recht gemeinnützige GmbH, Wiesbaden","Cluster ""Logistik RheinMain. Die Wissensinitiative"" Aufbauphase 2009 - 2011",2008,,"296.969,42"
"EBS Universität für Wirtschaft und Recht gemeinnützige GmbH, Wiesbaden",MarketingXChange - MArketing und Vertriebssupport für kleine Unternehmen,2009,,"38.410,90"
"ECOCAMPING e. V., Konstanz",Klimafreundlich Campen in Hessen 2013/2014,2013,,"49.800,00"
"eCommerce-Kompetenzzentrum Nordhessen GbR, Kassel",eCommerce-Center-Nordhessen,2008,,"140.000,00"
"eCommerce-Kompetenzzentrum Nordhessen GbR, Kassel",eCommerce Center Nordhessen (ECCN) Folgeantrag 2010 - 2011,2010,,"138.856,84"
"ECOWIN GmbH, Wettenberg",KompetenzNetz UmweltTechnologie - KNUT - Aufbauphase 2009 - 2011,2009,,"221.449,12"
"Eheleute Alfred und Irene Bücking, Seligenstadt","Pilot- und Demonstrationsvorhaben ""Mikro-BHKW-Brennstoffzelle Viessmann Vitovalor 330- P""",2015,,"18.531,00"
"Eheleute Claudia und Wolfram Klass, Bensheim","Pilot- und Demonstrationsvorhaben ""Brennstoffzellenheizgerät Ceramic Fuel Cells BlueGen""",2015,,"19.175,00"
"Eheleute Dagmar und Eckard Ott, Rüsselsheim","Pilot- und Demonstrationsvorhaben ""Mikro-BHKW-Brennstoffzelle Viessmann Vitovalor 330- P""",2015,,"13.147,95"
"Eheleute Dr. Michael Streubel und Marianne Streubel-Glatthaar, Schlangenbad","Pilot- und Demonstrationsvorhaben ""Mikro-KWK-Brennstoffzelle Solid Power GmbH BlueGEN""",2015,,"17.195,00"
"Eheleute Maren und Tobias Schrader, Großkrotzenburg","Pilot- und Demonstrationsvorhaben ""Mikro-BHKW-Brennstoffzelle Viessmann Vitovalor 300- P""",2015,,"13.266,00"
"Eheleute Uwe und Silke Loth, Vellmar","Pilot- und Demonstrationsvorhaben ""Mikro-BHKW-Brennstoffzelle Viessmann Vitovalor 300- P""",2015,,"17.986,00"
"Eigenbetrieb Bildung und Kultur der Stadt Rüsselsheim, Rüsselsheim",Brandschutzmaßnahmen und Beschaffungen für die vhs- Bildungszentren in der Kürbisstraße und Albrecht-Dürer-Schule,2013,,"22.217,00"
"Eigentümergemeinschaft Gonzalez Severino und Näther, Hattersheim","Pilot- und Demonstrationsvorhaben ""Mikro-BHKW-Brennstoffzelle Viessmann Vitovalor 330- P""",2015,,"13.216,00"
"Eigentümergemeinschaft Ingo Weiß und Frederike Watz, Vellmar","Pilot- und Demonstrationsvorhaben ""Mikro-BHKW-Brennstoffzelle Viessmann Vitovalor 300- P""",2015,,"17.249,00"
"Eigentümergemeinschaft Theresia und Erich Gleißer, Rüsselsheim","Pilot- und Demonstrationsvorhaben ""Mikro-BHKW-Brennstoffzelle Viessmann Vitovalor 300- P""",2015,,"16.553,14"
"Eigentümergemeinschaft von Oelsen, Königstein","Pilot- und Demonstrationsvorhaben ""Mikro-BHKW-Brennstoffzelle Viessmann Vitovalor 300- P""",2015,"12.794,52",
"EKO-PLANT Entwicklungs- und Betriebsgesellschaft für ökotechnische Anlagen mbH, Neu-Eichenberg",Erweiterung einer Betriebsstätte in 37249 Neu-Eichenberg,2008,,"263.400,00"
"EKO-PLANT Entwicklungs- und Betriebsgesellschaft für ökotechnische Anlagen mbH, Neu-Eichenberg",Erweiterung einer Betriebsstätte in 37249 Neu-Eichenberg,2014,,"300.000,00"
"EMD Deutschland GbR, Kassel",Einstellung eines/r Innovationsassistenten/in in 34119 Kassel,2010,,"25.000,00"
"EMTech GmbH, Darmstadt",iREACT-Prognose,2015,,"25.000,00"
"Energenio AG, Dautphetal",Einstellung eines/r Innovationsassistenten/in in 35232 Dautphetal,2011,,"27.016,00"
"EnergieEffizienzAgentur Rhein-Neckar, Ludwigshafen","Projekt ""Energiekarawane in der Metropolregion Rhein-Neckar""",2012,,"6.168,51"
"Energiepunkt Frankfurt - Energieberatungszentrum Frankfurt e.V., Frankfurt","Projekt ""Einrichtung und Gründung einer überörtlichen Energieagentur""",2015,,"35.913,97"
"Engineering-High-Tech-Cluster Fulda e.V., Fulda",Engineering-High-Tech-Cluster Fulda - Aufbauphase,2010,,"35.088,29"
"Engineering-High-Tech-Cluster Fulda e.V., Fulda",Engineering-High-Tech-Cluster in der Region Fulda - Verstetigung,2013,"105.100,00",
"EngRoTec GmbH & Co. KG (BtG) EngRoTec Immobilien GmbH & Co. KG (BsG), Hünfeld",Erweiterung einer Betriebsstätte in 36088 Hünfeld,2013,,"752.320,85"
"ENTEGA AG, Darmstadt",Entwicklungsvorhaben „Einsatz eines saisonalen Erdsonden-Wärmespeichers zur Optimierung des Wärmedeckungsgrades regenerativer Energieversorgungssysteme“,2013,,"98.400,00"
"ENTEGA AG, Darmstadt","Demonstrationsvorhaben ""Versorgung der Fa. Frenger Systemen B.V. Heiz- und Kühltechnik GmbH mit geothermischer Energie""",2015,,"296.464,77"
"Entwicklungsgesellschaft Lorsch mbH, Lorsch",Virtuelles Gründerzentum Lorsch,2012,,"121.677,58"
"Entwicklungsgesellschaft Lorsch mbH, Lorsch",Virtuelles Gründerzentum Lorsch,2015,,"10.972,34"
"eOpinio GmbH Meinungsgemeinschaft für Deutschland, Gießen",Einstellung eines Innovationsassisstenten in 35394 Gießen,2012,,"22.000,00"
"Equinix Germany GmbH, Frankfurt","Demonstrationsvorhaben ""Brennstoffzelle im Rechenzentrum Frankfurt""",2014,,"450.400,00"
"Erbacher Lichtspiele GbR R. Eckerlin + I. Clauss, Erbach","Umrüstung von 2 Leinwänden von analoger auf digitale Projektions technik, Erbacher Lichtspiele, Obere Marktstraße 1, 64711 Erbach",2011,,"38.095,00"
"Erbacher Lichtspiele GbR R. Eckerlin + I. Clauss, Erbach","Umrüstung einer Leinwand von analoger auf digitale Projektionste chnik der Erbacher Lichtspiele, Kinosaal 2",2013,,"15.445,14"
"ERF Medien e.V., Wetzlar","Demonstrationsvorhaben ""Kraft-Wärme-Kopplung zur Kühlung & Stromversorgung""",2014,,"22.650,00"
"Evangelischer Verein für Jugendsozialarbeit in Frankfurt e.V., Frankfurt am Main",Beschaffung einer neuen Kreissäge für die Ausbildungsschreinerei der Produktionsschule Lernbetrieb Frankfurt am Main,2012,,"12.624,11"
"Evangelischer Verein für Jugendsozialarbeit in Frankfurt e.V., Frankfurt am Main",Beschaffung einer Kantenanleinmaschine für die Ausbildungsschreinerei der Produktionsschule Frankfurt am Main,2013,,"15.181,00"
"FAB gGmbH für Frauen Arbeit Bildung, Friedberg",FAB Akademie 2008,2008,,"7.588,65"
"FAB gGmbH für Frauen Arbeit Bildung, Friedberg",FAB Akademie 2009,2009,,"20.632,03"
"Fachhochschule Frankfurt am Main, Frankfurt",Erstellung einer Solardach-Potenzialanalyse/Pilotprojekt für das Land Hessen,2012,,"231.000,00"
"Fachverband Elektro- und Informationstechnik Hessen/Rheinland-Pfalz, Wiesbaden",Technologietransfer-Stelle,2008,,"11.000,00"
"Fachverband Elektro- und Informationstechnik Hessen/Rheinland-Pfalz, Wiesbaden","Technologietransfer, Technologieberatung 2009",2009,,"12.100,00"
"Fachverband Elektro- und Informationstechnik Hessen/Rheinland-Pfalz, Wiesbaden","Technologietransfer, Technologieberatung 2010",2010,,"12.100,00"
"Fachverband Elektro- und Informationstechnik Hessen/Rheinland-Pfalz, Wiesbaden","Technologietransfer, Technologieberatung 2011",2011,,"12.100,00"
"Fachverband Elektro- und Informationstechnik Hessen/Rheinland-Pfalz, Wiesbaden","Technologietransfer, Technologieberatung 2012",2012,,"12.100,00"
"Fachverband Elektro- und Informationstechnik Hessen/Rheinland-Pfalz, Wiesbaden","Technologietransfer, Technologieberatung 2013",2013,,"12.100,00"
"Fachverband Elektro- und Informationstechnik Hessen/Rheinland-Pfalz, Wiesbaden","Technologietransfer, Technologieberatung 2014",2014,,"12.100,00"
"Fachverband Elektro- und Informationstechnik Hessen/Rheinland-Pfalz, Wiesbaden","Technologietransfer, Technologieberatung 2015",2015,,"12.100,00"
"Fantasia Filmtheaterbetriebsgesellschaft mbH, Bad Vilbel","Umrüstung einer Leinwand von analoger auf digitale Projektionste chnik, Fantasia Filmtheater",2013,,"12.203,00"
"FAPRIK gGmbH, Frankfurt am Main",Bauliche Modernisierungs- und Ausstattungsmaßnahmen am Standort Spessartstraße 11 in 60385 Frankfurt,2009,,"13.600,00"
"FAPRIK gGmbH, Frankfurt am Main",Beschaffung von Ausstattungen für die Qualifizierungs- und Beschäftigungsprojekte in Frankfurt a. M.,2012,,"21.839,49"
"F.A.Z.-Institut für Management-, Markt- und Medieninformationen GmbH, Frankfurt am Main",Best Excellence 2/2008,2008,,"75.000,00"
"F.A.Z.-Institut für Management-, Markt- und Medieninformationen GmbH, Frankfurt am Main",Kompass 2008,2008,,"99.500,00"
"F.A.Z.-Institut für Management-, Markt- und Medieninformationen GmbH, Frankfurt am Main",Gründerflirt,2008,,"64.000,00"
"F.A.Z.-Institut für Management-, Markt- und Medieninformationen GmbH, Frankfurt am Main",BEST Excellence 2009,2009,,"150.000,00"
"F.A.Z.-Institut für Management-, Markt- und Medieninformationen GmbH, Frankfurt am Main",Kompass 2009,2009,,"199.500,00"
"F.A.Z.-Institut für Management-, Markt- und Medieninformationen GmbH, Frankfurt am Main",BEST Excellence 2010,2010,,"150.000,00"
"Medieninformationen GmbH, Frankfurt am Main",,,,
"F.A.Z.-Institut für Management-, Markt- und Medieninformationen GmbH, Frankfurt am Main",Kompass 2010,2010,,"199.500,00"
"F.A.Z.-Institut für Management-, Markt- und Medieninformationen GmbH, Frankfurt am Main",BEST EXCELLEENCE 2011,2011,,"150.000,00"
"F.A.Z.-Institut für Management-, Markt- und Medieninformationen GmbH, Frankfurt am Main",Kompass 2011,2011,,"150.000,00"
"F.A.Z.-Institut für Management-, Markt- und Medieninformationen GmbH, Frankfurt am Main",BEST Excellence 2012,2012,,"150.000,00"
"F.A.Z.-Institut für Management-, Markt- und Medieninformationen GmbH, Frankfurt am Main",Gründerflirt 2012-2013,2012,,"235.000,00"
"F.A.Z.-Institut für Management-, Markt- und Medieninformationen GmbH, Frankfurt am Main",IT-Transfer 2012,2012,,"150.000,00"
"F.A.Z.-Institut für Management-, Markt- und Medieninformationen GmbH, Frankfurt am Main",BEST Excellence 2013,2013,,"150.000,00"
"F.A.Z.-Institut für Management-, Markt- und Medieninformationen GmbH, Frankfurt am Main",IT-Transfer 2013,2013,,"150.000,00"
"Filmladen Kassel e. V., Kassel","Umrüstung einer Leinwand von analoger auf digitale Projektionste chnik, Open Air Kino des Filmladens Kassel",2014,,"14.900,00"
"Filmladen Kassel e.V., Kassel","Umrüstung einer Leinwand von analoger auf digitale Projektions technik, Filmladen Kassel e. V.",2011,,"18.697,20"
"Filmseher Kulturmanagement OHG, Seeheim-Jugenheim",Umrüstung des Filmtheaters Freilichtbühne Seeheim-Jugenheim von analoger auf digitale Projektionstechnik,2014,,"9.239,93"
"Filmtheaterbetrieb Ralf Schuhmacher, Witzenhausen",Umrüstung von analoger auf digitale Projektionstechnik,2013,,"31.166,61"
"Filmtheaterbetriebe Dieter Lachner, Bad Vilbel","Umrüstung von 2 Leinwänden von analoger auf digitale Projektions technik, Cinepark Karben, Robert-Bosch-Straße 62, 61184 Karben",2011,,"32.187,50"
"Filmtheaterbetriebe Manfred Ewert KG, Wiesbaden","Umrüstung von fünf Leinwänden von analoger auf digitale Projek tionstechnik, Apollo- Center, Wiesbaden",2012,,"73.138,00"
